TYPE	NUMBER	KEYWORD	ORGANIC	URL	TITLE	DESCRIPTION	PAGE	FLAG_HACKED	FLAG_HARMFUL	STAT_RESULTCOUNT
result	190	masters data science	organic	https://masters.fib.upc.edu/masters/miri-data-science	MIRI - Data Science - Masters FIB - UPC	The master's degree equips graduates with solid knowledge and hands-on experience in techniques for managing, analyzing and extracting hidden knowledge from structured and unstructured big data ensembles and in building adaptive analytic systems that are able to exploit that knowledge in modern organizations.	2	0	0	1080000
result	191	masters data science	organic	https://www.quora.com/Is-a-masters-in-Data-Science-worth-it	Is a masters in Data Science worth it? - Quora	This was originally posted on his reddit AMA (which was recent featured at TED), and directed at someone who was asking whether a master in computer science was the best way to learn machine learning. His answer is also directly relevant to anyone considering a Masters in Data Science and wanting to become a data ...	2	0	0	1080000
result	192	masters data science	organic	https://www.universiteitleiden.nl/en/education/study-programmes/master/statistical-science-for-the-life-and-behavioural-sciences/data-science-statistical-science	Data Science: Statistical Science (MSc) - Universiteit Leiden	The Data Science for Statistical Science master's specialisation at Leiden University gives you a better understanding of statistical models, especially in relation to Data Science, including their application and interpretation in a broad range of empirical research.	2	0	0	1080000
result	193	masters data science	organic	https://courses.aber.ac.uk/postgraduate/masters-data-science/	Aberystwyth University - Postgraduate Courses - Data Science	Data Science is a rapidly growing interdisciplinary area, with applications in business, government, public health, and the sciences. Its applications range from ... Our taught masters degrees are designed to meet the needs both of students intending a career in research, and those who want to accelerate an industrial career ...	2	0	0	1080000
result	194	masters data science	organic	http://www.mdx.ac.uk/courses/postgraduate/msc-by-research-data-science	Data Science MSc by Research | Middlesex University London	Scholarships worth 50% of the master's fee and postgraduate student loans available - apply now. The MSc by Research Data Science provides an opportunity to undertake an individual real-world big-data research project across a variety of interdisciplinary domains.	2	0	0	1080000
result	195	masters data science	organic	http://datascience.kennesaw.edu/	Analytics and Data Science Institute - Kennesaw State University	Kennesaw State University's Ph.D. in Analytics and Data Science.	2	0	0	1080000
result	196	masters data science	organic	http://www.sru.edu/academics/graduate-programs/data-analytics-master-of-science	Data Analytics (Master of Science) | Slippery Rock University	Slippery Rock University's Master of Science in Data Analytics is 33 credits and consists of online coursework.	2	0	0	1080000
result	197	masters data science	organic	http://www.manchester.ac.uk/study/masters/courses/list/11424/msc-data-science/course-details/	MSc Data Science - course details (2018 entry) | The University of ...	This innovative master's in data science is an opportunity for graduates from a broad range of disciplines to develop data science skills. Our goal is to help you develop into an agile, skilled data scientist, adept at working in variety of settings and able to meet the challenges and reap the rewards of interdisciplinary team ...	2	0	0	1080000
result	198	masters data science	organic	http://blogs.ionis-group.com/epita/international/2017/05/new-masters-specialization-at-epita-data-science-analytics-dsa-master-of-computer-science-in-paris.html	New Master's Specialization at EPITA: Data Science & Analytics (DSA ...	May 26, 2017 - EPITA is proud to offer a new master's specialization in computer science starting Fall 2017. The dean of the international programs Rabih HADDAD today announced it will offer new specialization in the domain of information technology: MSc-CGE in Data Science & Analytics. The program provides a good ...	2	0	0	1080000
result	199	masters data science	organic	https://catalog.fullerton.edu/preview_program.php?catoid=16&poid=7843&returnto=1926	Program: Information Technology, Data Science Concentration, M.S. ...	The Information Technology, Data Science Concentration master's program provides students with knowledge, skills and experience in data processing and analytics in the context of business. Students will learn to articulate strategies and methods that allow for the effective use and management of data storage and ...	2	0	0	1080000
result	200	masters data science	organic	http://study.unisa.edu.au/degrees/master-of-data-science	Study Master of Data Science at the University of South Australia ...	Enter the revolutionary area of big data and graduate with current knowledge in data science techniques and research.	2	0	0	1080000
result	201	masters data science	organic	https://www.rit.edu/programs/data-science-ms	Data Science MS degree | RIT Programs of Study	This program is only available online. The MS in data science has a strong career focus and aims to prepare students with the practical and theoretical skills to handle large-scale data management and analysis challenges that arise in today's data-driven organizations. The program enables students to work with active ...	3	0	0	290
result	202	masters data science	organic	https://www.davenport.edu/programs/arts-and-sciences/master-of-science/master-of-science-in-data-analytics-ms	Master of Science in Data Analytics, MS | Davenport University	The curriculum is part of DU's continuing efforts to identify and respond to strong need in the marketplace. The program allows participants to focus on real-world examples from their industry and will provide exposure to many of the software programs used in data analytics, as well as develop advanced communication and ...	3	0	0	290
result	203	masters data science	organic	http://infosci.cornell.edu/academics/undergraduate/undergraduate-concentrations/concentrations/data-science	Data Science | Cornell Information Science	This concentration will equip students to learn about the world through data analytics.	3	0	0	290
result	204	masters data science	organic	http://www.stat.cornell.edu/academics/mps	Master of Professional Studies (MPS) in Applied Statistics	The Master of Professional Studies (MPS) in Applied Statistics is for those who are interested in professional careers in business, industry, government or scientific research. Our MPS program provides rigorous training in modern data analytical skills that are sought after in almost any field. Currently, Cornell is the only Ivy ...	3	0	0	290
result	205	masters data science	organic	https://www.exeter.ac.uk/postgraduate/taught/datascience/	Data Science and Analytics 2018/19 | Postgraduate Taught Study ...	The demand for expertise in managing and interrogating big data sets to improve decision-making, drive policy and make scientific breakthroughs, far outstrips supply. Data Science at the University of Exeter, offers a broad range of programmes that equip students with both the technical skills to understand, manage and ...	3	0	0	290
result	206	masters data science	organic	https://www.reddit.com/r/datascience/comments/7o21qw/berkeley_master_data_science_mids_vs_other_online/	Berkeley Master Data Science (MIDS) vs. other online data science ...	Hi all, I am planning to start an online Master's program in Data Science this year and was wondering if anybody has experience with any of these...	3	0	0	290
result	207	masters data science	organic	http://www.ucl.ac.uk/prospective-students/graduate/taught/degrees/data-science-msc	Data Science MSc | UCL London's Global University	Feb 5, 2018 - Data science brings together computational and statistical skills for data-driven problem solving, which is in increasing demand in fields such as marketing, pharmaceutics, finance and management. This MSc will equip students with the analytical tools.	3	0	0	290
result	208	masters data science	organic	https://www.stjohns.edu/academics/schools-and-colleges/college-professional-studies/programs-and-majors/data-mining-and-predictive-analytics-master-science	Data Mining and Predictive Analytics, Master of Science	Predictive analytics applies powerful statistical and data mining techniques to large data sets in order to generate useful information, identify patterns and trends, and build models to predict future events. Applications of these techniques are now transforming decision-making throughout business, government, healthcare, ...	3	0	0	290
result	209	masters data science	organic	http://sharpsightlabs.com/blog/rapidly-master-data-science/	How to rapidly master data science - SHARP SIGHT LABS	Sep 29, 2017 - For some people, learning the basics of data science takes years. Now, I'll admit that if you eventually want to be one of the 'best of the best,' you will have to put in years of effort. But to master the basics? Years? Just to get the foundations? It should not take that long. Any smart, dedicated person should be ...	3	0	0	290
result	210	masters data science	organic	https://www.unlv.edu/degree/ms-data-analytics-and-applied-economics	Master of Science - Data Analytics and Applied Economics ...	The MS in Data Analytics and Applied Economics combines skills in programming, data gathering, and data management from courses in the Lee Business School's Management Entrepreneurship, and Technology (MET) department, with skills in economic reasoning and statistical analysis skills taught in graduate-level ...	3	0	0	290
result	211	masters data science	organic	https://www.ugr.university/pages/prospective_students/masters_students/masters-programmes/datascienceandcomputerengineering	Data Science and Computer Engineering | University of Granada	Our Masters in Data Science and Computer Engineering is a cutting edge programme designed to enable student become leading experts in the field. The course combines diverse and overlapping lines of research at the forefront of the discipline, thereby addressing a growing need in current international labour markets ...	3	0	0	290
result	212	masters data science	organic	https://www.clarkson.edu/graduate/data-analytics	Data Analytics | Clarkson University	The Master of Science in Data Analytics program provides you with the skills to be an effective professional in a rapidly growing field. Upon completion, you will be able to identify, acquire, manage, present, analyze and interpret large amounts of data in a variety of organizational settings. You'll learn how to turn big data into ...	3	0	0	290
result	213	masters data science	organic	https://www.uis.edu/math/masters-in-data-analytics/	Masters in Data Analytics – Department of Mathematical Sciences - UIS	Master of Science. The M.S. degree in Data Analytics (MSDA) is offered in on-campus, online, and blended formats. On-ground students will have the option of taking online or blended classes as well. The degree aims at providing an interdisciplinary approach to data analytics that covers both the foundational ...	3	0	0	290
result	214	masters data science	organic	https://www.nu.edu/OurPrograms/SchoolOfEngineeringAndTechnology/ComputerScienceAndInformationSystems/Programs/MasterofScienceinDataAnalytics.html	Master of Science in Data Analytics | National University - Graduate ...	The Master of Science in Data Analytics graduate program is designed to give a foundation in analytics, offering courses in big data mining and predictive modeling.	3	0	0	290
result	215	masters data science	organic	https://www.unh.edu/analytics/master-science-analytics	Master of Science in Analytics | University of New Hampshire	As the use of analytics grows, so does the demand for people who know how to skillfully extract value from massive amounts of data. The University of New Hampshire's Master of Science in Analytics degree prepares graduates to fill the current gap in the marketplace. Analytics experts are needed - and in just 11 months, ...	3	0	0	290
result	216	masters data science	organic	http://mines-nancy.univ-lorraine.fr/content/big-data-data-science	Big Data & Data Science | École des Mines de Nancy	The «Big Data and Data Science» curriculum is both a Master level program for the French students at Mines Nancy, and a track for foreign exchange students. While the courses are given in English for convenience, students are entirely integrated with French students during sessions and have the opportunity to fully ...	3	0	0	290
result	217	masters data science	organic	https://en.itu.dk/programmes/bsc-programmes/data-science	Data Science - IT University of Copenhagen	With a BSc in Data Science, you will become the next generation analyst - a data scientist with comprehensive analytical and technical skills covering all aspects of ... This qualifies you to continue your studies in a master's programme at the IT University or a different Danish or foreign university in the areas of science, social ...	3	0	0	290
result	218	masters data science	organic	https://www.snhu.edu/online-degrees/masters/ms-in-data-analytics	Master's in Data Analytics Online | MS Business Analytics | SNHU	SNHU's MS analytics degree is recognized by the Professional Science Master's (PSM) national office as a Professional Science Master's program. The PSM is an innovative degree designed to allow students to pursue advanced training in science or mathematics while developing workplace skills valued by employers.	3	0	0	290
result	219	masters data science	organic	https://www.theguardian.com/education/2016/mar/22/postgraduate-student-masters-degrees-data-science-sexiest-job-21st-century	Want to be the next Tim Berners-Lee? Consider a data science master's	Mar 22, 2016 - The new MSCs in data science are tapping into the current information explosion. After all, big data is of little use without skilled people to make use of it.	3	0	0	290
result	220	masters data science	organic	http://ecampus.oregonstate.edu/online-degrees/graduate/data-analytics/	Data Analytics -- Graduate Degrees & Programs -- Online & Distance ...	Earn a Master of Science degree or Graduate Certificate in Data Analytics online through Oregon State Ecampus, a national leader in online education.	3	0	0	290
result	221	masters data science	organic	https://harvardmagazine.com/2017/03/data-science-institute	Harvard plans significant data science institute | Harvard Magazine	Mar 28, 2017 - The evolving field has attracted interest throughout academia, ranging from Georgia Tech's new online master's degree in data science, offered through edX, to Yale's recently reenvisioned department of statistics as a department of statistics and data science (“DS2”)—complete with a reconceived ...	3	0	0	290
result	222	masters data science	organic	https://poetsandquants.com/2017/02/15/study-data-science-curriculum-continues-surge/	Study: Data Science Curricula Surges - Poets&Quants	Feb 15, 2017 - Of course, it's only been a few years since big data and data science began to be adopted on a curricular spectrum at elite B-schools. In 2013, New York University's Stern School of Business unveiled a master's degree in business analytics, and in that time schools from Indiana University's Kelley School of ...	3	0	0	290
result	223	masters data science	organic	https://www.wired.com/insights/2015/03/data-scientists-earning-salaries/	Are Data Scientists Earning Their Salaries? | WIRED	Gartner suggested that the “gravitational pull of big data is now so strong that even people who haven't a clue as to what it's all about report that they're running big data projects.” Indeed, their research with business decision makers suggests that organisations are struggling to get value from big data. Data scientists were ...	3	0	0	290
result	224	masters data science	organic	https://www.datacamp.com/	DataCamp: Learn R, Python & Data Science Online	Learn Data Science from the comfort of your browser, at your own pace with DataCamp's video tutorials & coding challenges on R, Python, Statistics & more.	3	0	0	290
result	225	masters data science	organic	https://analytics.stat.tamu.edu/for-students/student-spotlight/	Student Spotlight – Texas A&M MS Analytics	We are about more than just data ... to Analyze Patterns in Disability Fraud' analyzed data from disability claims filed under the Supplement Security Income program from years 2014 and 2015. Alfredo Escriba '17. Meet Alfredo and learn about his experience in the program. Women in Data Science. Kaylan T. '19 ...	3	0	0	290
result	226	masters data science	organic	https://www.datasciencecentral.com/	Data Science Central	Welcome to Data Science Central. The Community of and for Data Scientist.	3	0	0	290
result	227	masters data science	organic	https://www1.salary.com/Salaries-for-Data-Scientist-I-with-a-Masters-Degree-or-MBA	Salaries for Data Scientist I with a Master's Degree or MBA - Salary.com	Salaries for Data Scientist I with a Master's Degree or MBA. According to our 100% employer reported salary sources the median salary for a Data Scientist I with a Master's Degree or MBA is $58,453 - $61,434. Please try our salary wizard to explore how other factors like location, Years of experience and number of direct ...	3	0	0	290
result	228	masters data science	organic	https://www1.salary.com/Salaries-for-Data-Scientist-II-with-a-Masters-Degree-or-MBA	Salaries for Data Scientist II with a Master's Degree or MBA - Salary.com	Salaries for Data Scientist II with a Master's Degree or MBA. According to our 100% employer reported salary sources the median salary for a Data Scientist II with a Master's Degree or MBA is $74,551 - $77,251. Please try our salary wizard to explore how other factors like location, Years of experience and number of direct ...	3	0	0	290
result	229	masters data science	organic	https://www.uni-hannover.de/en/studium/studienangebot/	Courses at Leibniz Universität Hannover	Course Start: Winter semester. Restricted admission. Biologie im fächerübergreifenden Bachelor (Bachelor of Science). Course Start: Winter semester. Restricted admission. Biologie im Masterstudiengang Lehramt an Gymnasien (Master of Education). Course Start: Winter semester, summer semester. Restricted admission.	3	0	0	290
result	230	masters data science	organic	http://courtyardhomestead.com/inuv/1w3g3.php?mrt=msc-data-analytics	Msc data analytics	This Masters will provide you with a thorough grounding in state-of-the art methods for learning from data, both in terms of statistical modelling and computation. Download the course brochure (pdf). The MSc in Data Analytics & Digital Business will hone your business decision intelligence. The Data Science and Analytics ...	3	0	0	290
result	231	masters data science	organic	https://www.udacity.com/courses/ios	Udacity	Category. All · Android · Artificial Intelligence · Data Analytics · Data Science · Deep Learning · Developer Essentials · Digital Marketing · Georgia Tech Masters in CS · iOS · Machine Learning · Mobile App Development · Non-Tech · Self Driving Car · Software Engineering · Virtual Reality · Web Development ...	3	0	0	290
result	232	masters data science	organic	http://www.enpc.fr/design-by-data	Design by Data Mastère Spécialisé® - Advanced Master in ...	Accueil · Formation · Mastères Spécialisés®; Design by Data Mastère Spécialisé® - Advanced Master in Computational Design, Digital Manufacturing and Building Technologies. Design by Data Mastère Spécialisé® - Advanced Master in Computational Design, Digital Manufacturing and Building Technologies.	3	0	0	290
result	233	masters data science	organic	http://www.gartenservice-klein.de/hlsk/ra6k3.php?mrt=msc-data-analytics	Msc data analytics - Gartenservice Klein	This is a part-time Whether you are looking to start a career in data science or wanting to further develop your current career, our innovative online Masters programme in Data Analytics The MSc in Data Science Science and industry are crying out for a new generation of data scientists who combine the statistical skills of ...	3	0	0	290
result	234	masters data science	organic	https://www.naukri.com/job-listings-Group-Master-Data-Analyst-Pacific-Head-Hunter-Pune-5-to-10-years-100318004785	Group Master Data Analyst - Pune - Pacific Head Hunter - 5 to 10 ...	3 days ago - Job Description for the post of Group Master Data Analyst in Pacific Head Hunter in Pune for 5 to 10 years of experience. Apply Now!	3	0	0	290
result	235	masters data science	organic	https://tdwi.org/pages/best-practices-awards/recognition-for-business-intelligence-data-warehousing-implementation.aspx	TDWI Best Practices Award: Recognition for Innovative Big Data ...	Categories. Advanced Analytics and Data Science; Emerging Technologies and Methods; Enterprise Data Warehouses; Data Management Strategies; Big Data; Business Intelligence, Visual Analytics, and Data Discovery; BI and Analytics on a Limited Budget. View Category Descriptions ...	3	0	0	290
result	236	masters data science	organic	http://www.cs.utah.edu/	School of Computing	New Master of Software Development Degree ... University of Utah computer science graduate students are working with other institutions to develop software that combines computer images and data to create stunning imagery of the universe and solar ... The School will run a broad search in all areas of computer science.	3	0	0	290
result	237	masters data science	organic	http://www.kgi.edu/	KGI: Keck Graduate Institute of Claremont, California	With an entrepreneurial approach and industry connections, KGI provides pathways for students to become leaders in bioscience and healthcare.	3	0	0	290
result	238	masters data science	organic	https://study.com/articles/best_masters_degrees_for_business_analysts.html	Best Master's Degrees for Business Analysts - Study.com	Master's programs in data science are a popular choice for future business analysts since they combine statistics, business analytics, and computer science to get the most out of big data. The courses are designed to teach you to accurately answer business questions from a managerial standpoint using mathematical and ...	3	0	0	290
result	239	masters data science	organic	https://kti.altifresh.com/nSb	Eit digital masters data science	If you're interested in studying Data Science & Big Data in Finland you can view all 10 Masters programmes Master's Programme in Computer, Communication and Information Sciences - Machine Learning, Data Science and Artificial Intelligence. Find Bachelor's, Master's, and MBA programs. Take the Sqore Challenge to ...	3	0	0	290
result	240	masters data science	organic	http://www.rivettasistemi.com/plugins/content/apismtp/zvql/fant4.php?mrt=applied-statistics-phd-programs	Applied statistics phd programs - Rivetta Sistemi	The Master of Science in Applied Statistics Program at California State University, Long Beach, is an academic degree program which trains students to utilize statistical methods to draw valid and meaningful inferences from data. The department offers graduate certificates in Applied Statistics and Mathematics for Teachers.	3	0	0	290
result	241	masters data science	organic	http://centrals.com.au/wp-content/uploads/0drx/uirt6.php?mrt=smart-cities-master-degree	Smart cities master degree	Earn your Master's in Data Science online from Syracuse. This programme is unique in its focus on the core challenges facing our increasingly 'smart' cities, from their operational functions and planning through to management and control. Edit: 1st Edition. For students seeking master's degree programs; AU Smart Cities.	3	0	0	290
result	242	masters data science	organic	http://wblc.com.br/cache/eyjo/2v3lj.php?mrt=masters-in-analytics	Masters in analytics - WBLC	In today's digital economy, the ability to collect large amounts of quantifiable data and transform it into actionable intelligence is a key factor in successfully competing in the global marketplace. Learn more about the Master of Science in Analytics at Northwestern University. This article reviews top 10 masters program in ...	3	0	0	290
result	243	masters data science	organic	https://www.ft.com/mastersofscience2018	Masters of Science 2018 - Financial Times	We asked six top scientists to share the latest advances in their fields, from gene editing to robotics and the physics of time.	3	0	0	290
result	244	masters data science	organic	http://www.dakesdrugstore.com/wp-content/plugins/apikey/kfei/mdmk7.php?mrt=is-a-phd-worth-it-reddit	Is a phd worth it reddit - Dake's Drug Store	Positions that require a PhD generally What is the advantage of a PhD over a masters in statistics for data science Is a masters in Data Science worth Is it worth studying a PhD? And how much difference will a doctorate actually make to your career and employment prospects? Find out with our guide. I am currently an ...	3	0	0	290
result	245	masters data science	organic	https://www.weizmann.ac.il/math/	The Faculty of Mathematics and Computer Science	We have researchers working in a range of areas, including a variety of topics in mathematics and its applications, computer science, vision, and computational biology. See the list of our seminars for an indication of our areas of activity.	3	0	0	290
result	246	masters data science	organic	http://www.bestcolleges.com/features/top-online-masters-in-crime-scene-investigation-programs/	5 Best Online Master's in Crime Scene Investigation Programs for 2018	Students take a required core that covers biological evidence and serology, forensic science principles, forensic toxicology, laboratory QA/QC, and applied statistics for data analysis. Two required courses explore special topics a the field, including a survey examining the scientific literature of that field. Students can transfer ...	3	0	0	290
