TYPE	NUMBER	KEYWORD	ORGANIC	URL	TITLE	DESCRIPTION	PAGE	FLAG_HACKED	FLAG_HARMFUL	STAT_RESULTCOUNT
result	36	data science certification	organic	https://www.linkedin.com/learning/data-science-and-analytics-career-paths-and-certifications-first-steps-2016	Data Science and Analytics Career Paths and Certifications: First ...	Aug 15, 2016 - The career opportunities in data science, big data, and analytics are growing dramatically. These are among the most sought-after jobs in the tech world today. If you're interested in changing career paths, determining the right course of study, or deciding if certification is worth your time, this course is for ...	1	0	0	16300000
result	37	data science certification	organic	https://www.sdstate.edu/continuing-distance-education/data-science-certificate	Data Science Certificate | South Dakota State University	Apply Now Download the Fact Sheet Data science is one of the hottest careers in the nation today, with demand predicted to grow even more in the future. It's common to see it rated as the number one career in the nation on major employment websites such as CareerCast and Glassdoor. The SDSU Graduate Certificate in ...	1	0	0	16300000
result	38	data science certification	organic	https://www.uclaextension.edu/public/category/courseCategoryCertificateProfile.do?method=load&certificateId=177498732	Data Science | UCLA Extension	Courses in the intensive data science program may not be taken a la carte. Click "Apply Now" to join the specialization and indicate which format you will pursue. After paying the candidacy fee, Click here to join the 10-week Data Science Camp! This certificate program does not qualify for Federal Financial Aid. Students ...	1	0	0	16300000
result	39	data science certification	organic	https://business.uc.edu/graduate/certificates/cert-analytics.html	Data Science / Data Analytics, Carl H. Lindner College of Business ...	However, many organizations lack the knowledge to effectively utilize data analytics. As a result, a strong demand for professionals with analytics skills has developed and will continue. The Data Analytics certificate prepares individuals to develop logical data models, construct data warehouses, build visually effective data ...	1	0	0	16300000
result	40	data science certification	organic	https://louisville.edu/online/programs/certificate-programs/graduate-certificate-in-data-science	Graduate Certificate in Data Science — University of Louisville Online ...	The Graduate Certificate in Data Science at the University of Louisville is an 18-credit hour program offered 100% online by the Computer Engineering and Computer Science department.	1	0	0	16300000
result	41	data science certification	organic	https://www.lynda.com/Data-Science-tutorials/Data-Science-Analytics-Career-Paths-Certifications-First-Steps/642486-2.html	Data Science & Analytics Career Paths & Certifications: First Steps	Jan 26, 2018 - Learn about the jobs and most valuable certifications available in big data, data analytics, and data science.	1	0	0	16300000
result	42	data science certification	organic	http://bulletin.gwu.edu/arts-sciences/data-science/certificate/	Graduate Certificate in Data Science | University Bulletin | The George ...	Data Science, and the associated areas referred to as big data and data analytics, is a rapidly emerging technology field fueled by the dramatic growth in the amount of data involved in most areas of society. The12-credit graduate certificate in data science program allows students to study fundamental ideas that underlie ...	1	0	0	16300000
result	43	data science certification	organic	http://www.zdnet.com/article/microsofts-new-online-certification-program-kicks-off-with-data-science-specialization/	Microsoft's new online certification program kicks off with data science ...	Jul 13, 2016 - Microsoft is launching the pilot of an online certification program, called the "Microsoft Professional Degree", with a data-science-focused competency.	1	0	0	16300000
result	44	data science certification	organic	https://www.statistics.com/analytics-for-data-science/	Statistics.com - Analytics for Data Science Certificate	Analytics for Data Science Online Certificate. Program in Analytics and Statistical Studies (PASS). Are you a ... Business or Data Analyst needing to add data mining to your skill set to interface with vendors or programmers; Manager reponsible for analytics teams or vendors; Data Scientist, Software Engineer, or IT ...	1	0	0	16300000
result	45	data science certification	organic	https://scs.georgetown.edu/programs/375/certificate-in-data-science/curriculum	Curriculum | Certificate in Data Science | Georgetown University ...	To receive a Certificate in Data Science at Georgetown University School of Continuing Studies, students must complete the required eight courses listed.	1	0	0	16300000
result	46	data science certification	organic	https://cos.gmu.edu/cds/graduate-certificate-in-data-science/	Graduate Certificate in Data Science - George Mason University ...	This program of study is offered by the Department of Computational and Data Sciences in the College of Science. This certificate program focuses on mastering a variety of basic computational skills to manage and analyze data. The certificate is designed primarily for professionals in technical fields who seek to upgrade ...	1	0	0	16300000
result	47	data science certification	organic	https://www.sice.indiana.edu/graduate/degrees/data-science/programs/certificate.html	Certificate: Programs: Data Science: Degrees & Certificates: Graduate ...	﻿Application Instructions. For admissions consideration to the program, you will need to submit an online application (e-App). Please select “Data Science Certificate (online)” as your Academic Program and "Data Science Certificate (Online)" as your Academic Plan. To complete your application, follow the Online Certificate ...	1	0	0	16300000
result	48	data science certification	organic	http://www.montgomerycollege.edu/datascience	Data Science Curriculum and Certificate Program - Montgomery College	Nov 16, 2017 - Data Science Curriculum and Certificate Program. The Data Science Certificate is an excellent first stop for students wanting to increase their data literacy, improve their marketability, and/or prepare for a career in a data science field. It is also suitable for those who wish to advance their professional careers ...	1	0	0	16300000
result	49	data science certification	organic	https://catalog.ku.edu/engineering/electrical-engineering-computer-science/certificate-data-science/	Graduate Certificate in Data Science < The University of Kansas	The Graduate Certificate in Data Science (DS) requires 4 graduate-level courses and is designed to offer the state-of-the-art Data Science training to a wide range of students who are currently pursuing graduate training in a discipline that is outside EECS or those that are seeking post-baccalaureate training to enhance ...	1	0	0	16300000
result	50	data science certification	organic	http://www.byui.edu/mathematics/data-science	Data Science | BYU-Idaho	Data Scientists: High Demand. Both large and small companies collect and store massive amounts of data. They need data scientists that can provide actionable insight from the data. Our data science degree prepares individuals with the skills to program with, visualize, and interpret data for employers in this rapidly ...	1	0	0	16300000
result	51	data science certification	organic	http://www.tomsitpro.com/articles/big-data-certifications,2-706.html	Best Big Data Certifications - Tom's IT Pro	Oct 26, 2017 - Big data engineers are in reasonably high demand and usually command salaries of $101,000 or more (according to Glassdoor), where data scientists average about $128,500 in salary. We took a detailed look at certifications from Microsoft, MongoDB, Oracle, SAS and INFORMS. Check out the results ...	1	0	0	16300000
result	52	data science certification	organic	https://www.edureka.co/masters-program/data-scientist-certification	Data Science Masters Program - Edureka	It includes training on Statistics, Data Science, Python, Apache Spark & Scala, Tensorflow and Tableau. The curriculum has been determined by extensive research on 5000+ job descriptions across the globe. 13 Courses. 200+ Hours of interactive learning. Statistics Essentials for Analytics. 119. Data Science Certification ...	1	0	0	16300000
result	53	data science certification	organic	https://uwf.edu/cse/departments/computer-science/graduate-certificates/data-science/	Graduate Certificate in Data Science - University of West Florida	The Certificate in Data Science combines advanced computer programming and database system architectures with statistical analyses and modeling. This program is designed to address the need for a skill set that includes programming, computational, and analytical skills, all of which is applicable to business, healthcare ...	1	0	0	16300000
result	54	data science certification	organic	https://www.wright.edu/degrees-and-programs/catalog/programs/big-smart-data-sciences-certificate	Big and Smart Data Sciences Certificate | Wright State University	Program Description:There is an unprecedented growth in data collected by all types of organizations, for various scientific, medical, financial, and other purposes, as a result of activities in interconnected world including our social activities on the Web, by using sensors and other high throughput devices on or around ...	1	0	0	16300000
result	55	data science certification	organic	http://www.wesleyan.edu/qac/certificate/index.html	QAC Applied Data Science Certificate - Wesleyan University	Coordinator: Director of QAC. To earn the Applied Data Science Certificate, students must complete seven graded courses and the capstone Data Analysis Practicum.	1	0	0	16300000
result	56	data science certification	organic	https://ds.cs.umass.edu/academics/certificate-data-science	Certificate in Statistical and Computational Data Science | Center for ...	There are three pillars to Data Science: statistical skills, computer science and domain expertise. This certificate is offered jointly through the Statistics and Computer Science departments. The program blends topics in statistical methods, statistical computing, machine learning and algorithm development to train students to ...	1	0	0	16300000
result	57	data science certification	organic	https://www.wpi.edu/academics/study/data-science-certificate	Data Science Certificate | Academics | WPI	WPI's Graduate Certificate in Data Science prepares you to harness, analyze, and interpret data in real-world applications as data scientists. To complete this six-course certificate program, you'll take one class from each of the five core categories of Data Science coursework; Integrative Data Science, Mathematical ...	1	0	0	16300000
result	58	data science certification	organic	https://online.unh.edu/graduate-certificate-data-science	Graduate Certificate in Data Science | UNH Online	UNH Data Science Certificate Overview. The University of New Hampshire's Data Science Certificate exposes students to current, cutting edge algorithms, coding languages, statistical modeling and visualization tools through guided, online instruction and applied case studies. Gain mastery of Python, using it to wrangle ...	1	0	0	16300000
result	59	data science certification	organic	http://blog.kaggle.com/2017/03/02/becoming-a-data-scientist-profiling-ciscos-data-science-certification-program/	Becoming a Data Scientist: Profiling Cisco's Data Science Certification ...	Mar 2, 2017 - Today's subject matter experts and specialists are tomorrow's data scientists thanks to Cisco's Enterprise Data Science Office. Cisco Systems—a US technology company that develops, manufactures, and sells networking devices and management—has taken a forward-thinking and flexible approach to ...	1	0	0	16300000
result	60	data science certification	organic	https://extension.ucsd.edu/courses-and-programs/data-science-courses	Data Science Courses | UCSD Extension	The University of California San Diego Extension is a premier online research university for community leaders and professionals. Join today.data analysis and reporting courses in san diego.	1	0	0	16300000
result	61	data science certification	organic	https://my.nps.edu/web/data-sciences/nps-certificate-program	NPS Certificate Program - Naval Postgraduate School	The eight data science certificate educational skills requirements are categorized as Basic Computation, Basic Statistics and Data Analysis, Large Data, Machine Learning, Assessment, Supervised Learning, Unsupervised Learning, and Practice. Details below explain the interpretation of these skills. 1. Basic Computation.	1	0	0	16300000
result	62	data science certification	organic	https://analytics.uncc.edu/academics/graduate-certificate-course-map	Graduate Certificate Course Map - Data Science and Business Analytics	Core Requirements (9 Credit Hours). DSBA 6100 Big Data Analytics for Competitive Advantage. DSBA 6160 Database Systems. DSBA 6201 Business Intelligence and Analytics. Electives (6 Credit Hours) ​Students choose 1 course from each concentration. Data Science Electives. Business Analytics Electives.	1	0	0	16300000
result	63	data science certification	organic	https://mashable.com/2017/10/03/data-science-online-course/	Learn how to become a data scientist - Mashable	Oct 3, 2017 - Get everything you need to break into this dynamic field through the Certs School's Complete Data Science Certification Training Bundle, available now for less than $50. SEE ALSO: Learn Arduino by building 15 projects from scratch. Across more than 85 hours of content, you'll explore essential analytics ...	1	0	0	16300000
result	64	data science certification	organic	http://ualr.edu/informationscience/graduate-certificate-in-data-science/	Graduate Certificate in Data Science - Department of Information ...	The Graduate Certificate in Data Science will help to fill this demand by giving interested professionals the opportunity to get recognized for some basic training in the data and information science disciplines as well as giving them a stepping stone towards pursuing other graduate degrees such as the MS in Information ...	1	0	0	16300000
result	65	data science certification	organic	https://datascience.stackexchange.com/questions/334/what-do-you-think-of-data-science-certifications	education - What do you think of Data Science certifications ...	A certificate from Coursera or Cloudera just signalizes an interest but it does not move the needle. There is a lot more to consider and you can have a bigger impact by providing a comprehensive repository of your work (github profile for example) and by networking with other data scientists. Anyone hiring for a data science ...	1	0	0	16300000
result	66	data science certification	organic	http://catalog.apsu.edu/preview_program.php?catoid=23&poid=5309&returnto=933	Program: Data Science Certificate - Austin Peay State University ...	Required Courses. CSCI 5010 - Database Management Concepts 3; CSCI 5080 - Data Mining Applications 3; STAT 5120 - Regression Analysis 3. Select three (3) courses from the list below. CSCI 5095 - Data Mining Project 3; STAT 5125 - The Generalized Linear Model 3; STAT 5130 - Experimental Design 3; STAT 5140 ...	1	0	0	16300000
result	67	data science certification	organic	https://continue.yorku.ca/certificates/big-data-analytics-program/certificate-in-advanced-data-science-and-predictive-analytics/	Certificate in Advanced Data Science and Predictive Analytics | School ...	The part-time Big Data Analytics Program is delivered online on a part-time basis with on-campus evening lab time. Comprised of two unique certificates—the Certificate in Big Data Analytics and the Certificate in Advanced Data Science and Predictive Analytics— the program covers the domains identified by the INFORMS ...	1	0	0	16300000
result	68	data science certification	organic	https://sollers.edu/data-science-overview/	Data Science Overview New Design - Sollers	Data organization, management, and analysis are in high demand across industries and business types. Bad data can cost an organization millions of dollars every year, while companies using data-driven decision making are more productive and profitable. The need for data scientists has grown far beyond large ...	1	0	0	16300000
result	69	data science certification	organic	https://www.huffingtonpost.com/entry/the-9-best-free-online-big-data-and-data-science-courses_us_59afd5c9e4b0d0c16bb528db	The 9 Best Free Online Big Data And Data Science Courses | HuffPost	Sep 28, 2017 - This course is provided by Microsoft and forms part of their Professional Program Certificate in Data Science, although it can also be taken as a stand-alone course through EdX. Students are expected to have an “introductory” knowledge of R or Python – the two most popular languages for data science ...	1	0	0	16300000
result	70	data science certification	organic	http://www.northeastern.edu/online/degrees/graduate-certificate-data-science/	Graduate Certificate in Data Science | Northeastern University Online ...	It is an interdisciplinary program in which you build core knowledge in data mining, analysis, and the methods to communicate results in a meaningful way—critical skills for data-driven decision making in any discipline. Certificate credits can be applied to the MS in Bioinformatics, MS in Game Science and Design, MS in ...	1	0	0	16300000
result	71	data science certification	organic	https://hortonworks.com/blog/certification-ibm-data-science-experience-dsx-hdp-win-win-customers/	Certification of IBM Data Science Experience (DSX) on HDP is a Win ...	Nov 10, 2017 - We are pleased to announce the certification of IBM Data Science Experience (DSX) Local V1.1.2.01 with Hortonworks Data Platform (HDP) 2.6.3 / Ambari 2.6 on RHEL. As an important part of the agreement between the two companies, IBM and Hortonworks collaborated on an extensive set of test cases ...	1	0	0	16300000
result	72	data science certification	organic	https://usm.maine.edu/math/certificate-graduate-study-data-science	Certificate of Graduate Study in Data Science | Department of ...	The Department offers a graduate certificate in Data Science for those candidates who are interested in attaining a working knowledge of methodologies in data science. Currently enrolled graduate students can apply for this certificate before they graduate from the degree program. Program Goals: The certificate program ...	1	0	0	16300000
result	73	data science certification	organic	https://ww2.rockhurst.edu/helzberg/certificate-programs/data-science/curriculum	Helzberg School of Management - Data Science Curriculum ...	Classes within our 12-credit-hour data science certificate program are taught in a unique workshop format. Each week, you'll receive new datasets and learn methods to understand and analyze them.	1	0	0	16300000
result	74	data science certification	organic	https://www.discoverdatascience.org/programs/data-science-certification/	Data Science Certification | Graduate Certification Programs	Discover Data Science has the most comprehensive list of Certificate programs. There are over 50 programs to choose from with addtional options added regularly.	1	0	0	16300000
result	75	data science certification	organic	http://learnatcentral.org/professional-development/certificate-programs/introduction-to-data-science-certificate/	Introduction to Data Science Certificate | Seattle Central College ...	Expand your business and tech skills in this introduction to data science certificate class. Learn how to analyze data, use Python, and more.	1	0	0	16300000
result	76	data science certification	organic	https://www.jigsawacademy.com/full-stack-data-science/	Full Stack Data Science Program - Jigsaw - Jigsaw Academy	This is the most comprehensive Data Science course available, covering all steps of the Data Science process from Data Integration, Data Manipulation, .... Certificate - FS-DS. After completing this specialization, you would have mastered the most popular analytical tools – SAS, R, Python and Advanced SAS (SQL and ...	1	0	0	16300000
result	77	data science certification	organic	http://catalog.truman.edu/preview_program.php?catoid=13&poid=1885&returnto=613	Program: Data Science Certificate - Truman State University - Acalog ...	The Department of Computer Science at Truman State University offers a 15-credit hour graduate certificate in Data Science. Earning a Data Science Certificate prepares participants with the ability to manage, analyze, and draw conclusions from large amounts of data to apply it to numerous fields in science, business, ...	1	0	0	16300000
result	78	data science certification	organic	https://oes.umd.edu/graduates-post-baccalaureates-professionals/professional-graduate-programs/data-science	Data Science | Office of Extended Studies	Whether it's called big data analytics, predictive analytics, or advanced analytics, Data Science is a growing, evolving field—and nearly every industry is in need of professionals who have the skills required to guide decision-making processes. UMD's Graduate Certificate of Professional Studies in Data Science provides a ...	1	0	0	16300000
result	79	data science certification	organic	https://www.itcareerfinder.com/it-careers/big-data-scientist.html	Data Scientist | Training, Jobs, Salary, Certifications + Requirements	Data Scientists analyze business data for actionable intelligence. Data scientists mine and analyze data from a range of sources, including customer transactions, click streams, sensors, social media, log files and GPS plots. Their mission is to unlock valuable and predictive insights that will influence business decisions and ...	1	0	0	16300000
result	80	data science certification	organic	https://www.cloudera.com/more/news-and-blogs/press-releases/2014-03-26-cloudera-qualifies-data-scientists-with-new-certification-program.html	cloudera qualifies data scientists with new certification program	Hands-On Certification Prepares Data Scientists for Success with Real-World Data; Data Science Challenge Begins March 31. PALO ALTO, Calif. – March 26, 2014 – Cloudera, the leader in enterprise analytic data management powered by Apache Hadoop™, today announced the industry's first hands-on data science ...	1	0	0	16300000
result	81	data science certification	organic	http://greatbay.edu/courses/certificate-programs/data-practical-data-science	Data - Practical Data Science | Great Bay Community College	The Certificate in Practical Data Science is designed for undergraduate students and will supplement current administrative, journalistic and technical careers with marketable skills. Upon completion, the student will have gained a foundational understanding and related competencies in many facets of effective ...	1	0	0	16300000
result	82	data science certification	organic	http://datascience.uci.edu/data-science-certificate-program/	Data Science Certificate Program - UCI Data Science Initiative	Oct 31, 2017 - Familiarity with these analytic tools gives the certificate-holder a competitive advantage as a job candidate, and also enables more efficient and productive research. The short courses offered by the Data Science Initiative form a basic foundation in modern tools and techniques. Graduate Division will award ...	1	0	0	16300000
result	83	data science certification	organic	https://www.greatlearning.in/pg-program-data-science-engineering	Data science course, Data science certification, Data science training ...	Great Learning imparts Data Science Course and Data Science training leading to industry accepted data science certification in Gurgaon (Delhi NCR)and Bangalore. Great Learning also has centers in Mumbai, Pune, Chennai and Hyderabad helping working professionals in expanding career.	1	0	0	16300000
result	84	data science certification	organic	http://www.ingrammicroadvisor.com/data-center/10-big-data-certifications-that-will-be-pay-dividends	10 Big Data Certifications That Will Pay Dividends	Certified Analytics Professional (CAP) - INFORMS, the Institute for Operations Research and the Management Sciences, has its own big data certification training in end-to-end analytics. Certification includes training in framing business and analytic problems, acquiring data, developing analytical methodologies, model ...	1	0	0	16300000
result	85	data science certification	organic	https://www.eventbrite.com/e/data-science-certification-training-in-greater-chicago-areail-tickets-41699956693	Data Science Certification Training in Greater Chicago Area,IL Tickets ...	Jan 16, 2018 - Eventbrite - Trainerkart Americas, INC presents Data Science Certification Training in Greater Chicago Area,IL - Tuesday, January 16, 2018 | Friday, December 20, 2019 at Business Hotel, Chicago, IL. Find event and ticket information.	1	0	0	16300000
result	86	data science certification	organic	https://digitaldefynd.com/data-science-certifications-courses-tutorials/	18 Best Data Science Certifications, Degree, Course & Tutorial [2018]	Mar 6, 2018 - The decision to study Data Science is easier than finding the right course to help you learn the skills :) We try to help you find the perfect one as per your needs. 18 Best Data Science Certifications, Degree, Course & Tutorial Online 1. Machine Learning Certification by Stanford University Andrew Ng, former.	1	0	0	16300000
