TYPE	NUMBER	KEYWORD	ORGANIC	URL	TITLE	DESCRIPTION	PAGE	FLAG_HACKED	FLAG_HARMFUL	STAT_RESULTCOUNT
result	1	data science bootcamp	organic	https://www.switchup.org/research/best-data-science-bootcamps	Learn Data Science - 2018 Guide To The Best Data Science Bootcamps	Jan 6, 2018 - Find the data science course for you. Compare the best data science bootcamps and get expert tips on how to become a data scientist.	1	0	0	2280000
result	2	data science bootcamp	organic	https://www.thisismetis.com/data-science-bootcamps	Data Science Bootcamps | Metis	Learn data science in an immersive environment with in-class instruction of theory and technique and use real data to build a five-project portfolio to present to potential employers. The rigorous program includes machine learning, programming in multiple languages ( Python, UNIX, JavaScript ), data wrangling, project ...	1	0	0	2280000
result	3	data science bootcamp	organic	https://www.cio.com/article/3051124/careers-staffing/10-boot-camps-to-kick-start-your-data-science-career.html	17 best data science bootcamps for boosting your career | CIO	6 days ago - Data science is one of the fastest growing careers today and there aren't enough employees to meet the demand. Whether you're a recent grad, seasoned IT pro or someone looking to make a career change, these bootcamps will set you on the right path for a career in data science.	1	0	0	2280000
result	4	data science bootcamp	organic	https://datasciencedojo.com/bootcamp/	Data Science Bootcamp | Data Science Dojo	Data Science for Everyone. Short-duration, in-person, hands-on data science bootcamp that has helped 2700+ professionals from 380+ companies, globally.	1	0	0	2280000
result	5	data science bootcamp	organic	https://www.coursereport.com/blog/learn-data-science-at-these-13-bootcamps-and-programs	Learn Data Science at These 20 Coding Bootcamps - Course Report	May 22, 2017 - Check out this comprehensive list of the best data science bootcamps and programs for technologies like Hadoop, R, and Python.	1	0	0	2280000
result	6	data science bootcamp	organic	https://nycdatascience.com/data-science-bootcamp/	Data Science Bootcamp | NYC Data Science Academy	Learn data science through an immersive 12-week bootcamp with in-person instruction, real-world project experience, and personalized career support.	1	0	0	2280000
result	7	data science bootcamp	organic	https://www.thinkful.com/bootcamp/data-science/flexible/	Become a Data Scientist | Thinkful Data Science	20-30 Hrs. 20-30 hours a week means you can get ready for a new job without having to quit your job. Graduate in 6 months. Your Schedule. A flexible bootcamp-style program means you can set your own schedule to fit your life. Guarantee. No matter how you choose to pay, you'll still get a job or your money back.	1	0	0	2280000
result	8	data science bootcamp	organic	http://www.mastersindatascience.org/schools/data-science-bootcamps/	Data Science Training | Directory of Bootcamps	Bootcamps are short, intense educational programs that are intended to get data professionals up to speed in critical data science skills and technologies. As a data scientist, you'll often have to use a variety of tools and tricks (e.g. Hadoop) to make big data work for organizations. Bootcamps are intended to help you fill your ...	1	0	0	2280000
result	9	data science bootcamp	organic	https://techbeacon.com/complete-guide-data-science-bootcamps	Complete guide to the top 16 data science bootcamps - TechBeacon	We researched dozens of data science and machine learning boot camps and gathered the granular information developers need to choose the best fit...	1	0	0	2280000
result	10	data science bootcamp	organic	http://www.k2datascience.com/	K2 Data Science	An online data science bootcamp for working professionals with technical backgrounds. Become a data scientist and take charge of your career.	1	0	0	2280000
result	11	data science bootcamp	organic	https://www.meetup.com/Columbus-Data-Science-Meetup/	Columbus Data Science Meetup (Columbus, OH) | Meetup	This is a group for anyone interested in data science and Big Data Analytics. Come learn more about how to leverage open-source tools like R, Python, and Scala to crunch and visualize big data sets!	1	0	0	2280000
result	12	data science bootcamp	organic	https://www.galvanize.com/data-science	Data Science San Francisco | Galvanize	To complete our immersive program, students work independently on an applied data science project that is unique to his or her interests or career aspirations in a Capstone Project. These projects reflect the technical skill set students have learned throughout the course, and demonstrate their competence and fitness as a ...	1	0	0	2280000
result	13	data science bootcamp	organic	https://generalassemb.ly/data/data-science	Data Science Courses & Bootcamps at General Assembly	Advance your career. Learn in-demand skills with data science courses and bootcamps at General Assembly, a global leader in tech education.	1	0	0	2280000
result	14	data science bootcamp	organic	https://towardsdatascience.com/arebootcampsworthit-b8eb4d28770d	Are Tech Bootcamps Worth It? - Towards Data Science	May 11, 2017 - There are bootcamps for all sorts of tech jobs. Demand for them has driven up the price — are they worth it?	1	0	0	2280000
result	15	data science bootcamp	organic	https://www.springboard.com/workshops/data-science-career-track	Data Science Career Track | Springboard	Data Science Career Track is your springboard to a data science career. Online, mentor-guided bootcamp, designed to get you hired. Get a job, or your money back.	1	0	0	2280000
result	16	data science bootcamp	organic	https://bootcamp.northwestern.edu/	Northwestern Boot Camps | Learn Web Development or Data Science ...	CODING. Northwestern Coding Boot Camp equips students with the key skills for frontend and backend web development in an engaging classroom environment. CONTINUE. DATA SCIENCE. Northwestern Data Science Boot Camp teaches professionals the fundamental skills needed to turn big data into competitive ...	1	0	0	2280000
result	17	data science bootcamp	organic	https://www.quora.com/Are-there-any-good-data-science-bootcamps-something-like-Hack-Reactor	Are there any good data science bootcamps (something like Hack ...	As Ty mentioned, data science bootcamps are too new to have ratings. So how do you tell which school is best for you? I'd recommend a few criteria to judge a data science bootcamp by: 1. Are they teaching up-to-date techniques? When it comes to da...	1	0	0	2280000
result	18	data science bootcamp	organic	https://www.udemy.com/python-for-data-science-and-machine-learning-bootcamp/	Python for Data Science and Machine Learning Bootcamp | Udemy	This comprehensive course is comparable to other Data Science bootcamps that usually cost thousands of dollars, but now you can learn all that information at a fraction of the cost! With over 100 HD video lectures and detailed code notebooks for every lecture this is one of the most comprehensive course for data science ...	1	0	0	2280000
result	19	data science bootcamp	organic	https://tdwi.org/events/conferences/las-vegas/information/data-science-bootcamp.aspx	Data Science Bootcamp | Transforming Data with Intelligence	Back by popular demand! Join the hundreds who have already taken the Data Science Bootcamp and learn the skills and tactics you need to succeedin data science. TDWI's Data Science Bootcamp will lay the groundwork for you to becomea data scientist. This two-day intensive learning experience covers the most ...	1	0	0	2280000
result	20	data science bootcamp	organic	https://cognitiveclass.ai/data-science-bootcamp/	Data Science Bootcamp - Cognitive Class	Welcome to the multi-day, intensive Data Science Bootcamp! This is a beginner-friendly, hands-on bootcamp, where you will learn the fundamentals of data science from IBM Data Scientists Saeed Aghabozorgi, PhD and Polong Lin. You will learn how to use a popular programming language for data analysis and data ...	1	0	0	2280000
result	21	data science bootcamp	organic	https://venturebeat.com/2014/04/15/ny-gets-new-bootcamp-for-data-scientists-its-free-but-harder-to-get-into-than-harvard/	NY gets new bootcamp for data scientists: It's free, but harder to get ...	Apr 15, 2014 - That's why these bootcamps — and other data science education initiatives, from online courses to university programs — are so crucial. If The Data Incubator encourages just one physicist, engineer, or statistician to pursue data science over day trading, that's a small but not insignificant step toward ...	1	0	0	2280000
result	22	data science bootcamp	organic	https://bootcamp.rutgers.edu/data/curriculum/	Curriculum Overview - Rutgers Data Science Bootcamp 24 Weeks	Rutgers Data Science Bootcamp teaches highly applicable skills for data analysis and visualization that can benefit professionals and companies in any industry. It's a fact: Companies care about what you can do, not what you say you can do. For that reason, our curriculum teaches you how to put what you've learned to ...	1	0	0	2280000
result	23	data science bootcamp	organic	http://www.bigskycodeacademy.org/data-science-bootcamp/	In Person & Online Data Science Bootcamp - Big Sky Code Academy	Data Science is one of the fastest growing fields in tech. Become an in-demand data scientist. Learn data analytics and machine learning now.	1	0	0	2280000
result	24	data science bootcamp	organic	http://datascience.community/bootcamps	Data Science Bootcamps | DataScience.Community	DataScience.Community | Community site for all things data science.	1	0	0	2280000
result	25	data science bootcamp	organic	https://www.kaggle.com/general/16390	Data science bootcamps - Kaggle: Your Home for Data Science	I have some time in between (around 6 weeks) in which I would like to improve my datascience skills. Currently im able to program in R (quite profound) and have a good statisticial background. Im looking for a bootcamp kind a like initiative that can help me become a better data scientist. Preferably with machine Learning ...	1	0	0	2280000
result	26	data science bootcamp	organic	http://collaboratory.columbia.edu/bootcamp	Data Science Bootcamp - Collaboratory at Columbia University	The Collaboratory@Columbia is pleased to announce our second annual free Data Science Bootcamp coming up over the winter break. This week-long, immersive, hands-on workshop is especially designed for Columbia University PhD students and postdoctoral scholars who are interested in extending their existing ...	1	0	0	2280000
result	27	data science bootcamp	organic	https://www.kdnuggets.com/education/bootcamps.html	Bootcamps in Analytics, Big Data, Data Science, Machine Learning	Peaks Academy Data Science Bootcamp, Learn data science from anywhere in the world, without quitting your job. Principal Analytics Prep offers broad-based training in computing, statistics and business skills in an intensive bootcamp format for all backgrounds wanting to get into data analytics - learn from current hiring ...	1	0	0	2280000
result	28	data science bootcamp	organic	http://nashvillesoftwareschool.com/upcoming/data-science/	Data Science Bootcamp - Nashville Software School	Data Science is at the intersection of statistics/quantitative analysis, business acumen/domain expertise, and technology/“hacking” skills. The Data Science Bootcamp is designed to train students to work in data-intensive analytical jobs such as Data Scientist, Data Analyst, Big Data Engineer, etc. The bootcamp focuses on ...	1	0	0	2280000
result	29	data science bootcamp	organic	http://di-academy.com/bootcamp/	Data Science Bootcamp | di-academy.com	Welcome to the Summer Coding Camp and Data Science Bootcamp 2017 edition at DigitYser, our new location in Brussels! The invitation is open to both jobseekers and currently employed people wanting to acquire the basis for becoming data scientists. Organisations can boost their digital transformation either by ...	1	0	0	2280000
result	30	data science bootcamp	organic	https://www.ie.edu/exponential-learning/blog/etiqueta/data-science-bootcamp/	Data Science Bootcamp Archives - IE Exponential Learning Blog	What does Facebook have in common with Exxon Mobil and British Petroleum? The three are extraction companies. While BP and Exxon deal in extracting resources from […] Bootcamps. 19 January 2018. Data Science in Politics. 19 January 2018. Categories. Bootcamps ...	1	0	0	2280000
result	31	data science bootcamp	organic	https://www.youtube.com/watch?v=jknTOD9nRZA	Learn this Before Data Science Bootcamp with Debbie Berebichez of ...	Can anyone learn data science? What do you need to know before data science bootcamp? Do you need a ...	1	0	0	2280000
result	32	data science bootcamp	organic	https://bootcamp.extension.ucsd.edu/data/	The Data Science & Visualization Boot Camp | UC San Diego Extension	Students will learn the fundamental and specialized skills necessary to land a job or advance in the booming field of data analytics, including Python, JavaScript, Advanced Excel, SQL Databases and more. Students are equipped with the technical skills needed to translate data into competitive insights in the workplace, ...	1	0	0	2280000
result	33	data science bootcamp	organic	https://propulsionacademy.com/data-science-application/	Data Science Application | Propulsion Academy	Data Science bootcamp in 12 weeks. Get a job after graduation. Apply before March 1, 2018 and get CHF 1000 off tuition if accepted! APPLY NOW SEE PROGRAM Course information The next 12-week Data Science program will last from April 23 to July 13, 2018 and the tuition is CHF 11500. Anyone who applies before ...	1	0	0	2280000
result	34	data science bootcamp	organic	https://www.basecamp.ai/student/	Student — BaseCamp	Data science bootcamp for prospective data scientists in Vienna, Austria. Future is data! Are you ready to be a part of it?	1	0	0	2280000
result	35	data science bootcamp	organic	https://www.tieeco.org/event/data-science-boot-camp	Data Science Boot Camp Day 1 (December 2nd) - TiEeco	For college graduates or young professionals working in a technical field who are interested in exploring a career in data science, we are offering a two-day data science bootcamp. Why Data Science? There's a reason why The Harvard Business Review calls it “the sexiest job of the 21st century”. Data science is an ...	1	0	0	2280000
result	36	data science bootcamp	organic	https://www.thedatalab.com/what-we-do/skills-and-training/data-science-boot-camp	Data Science Boot Camp - The Data Lab	We are delighted to launch the first Data Lab professional development boot camp in collaboration with The Data Incubator, a leading US data science training organisation led by Michael Li, a former NASA analyst whose US-based courses are 'harder to get into than Harvard'. Scotland's first ever Data 'Boot Camp' will be ...	1	0	0	2280000
result	37	data science bootcamp	organic	https://www.datascienceretreat.com/	Data Science Retreat	Join our 3- month data science training program in Berlin.	1	0	0	2280000
result	38	data science bootcamp	organic	https://www.datanami.com/2016/06/23/whats-hot-summer-data-science-bootcamps/	What's Hot This Summer: Data Science Bootcamps - Datanami	Jun 23, 2016 - Summer is here and temperatures are rising. While some of us take vacations or cool off at the beach, prospective data scientists are heating up their job prospects by participating in one of a growing number of data science bootcamps. Bootcamps of all types are growing quickly. According to Course ...	1	0	0	2280000
result	39	data science bootcamp	organic	http://amitkaps.com/dsbootcamp	Data Science Bootcamp | Amit Kapoor	An Intensive Bootcamp to build your Data Science Portfolio. The availability of data has provided a rich playground to build data-driven products to help take business decisions. Whether you want to predict the resale value of an second hand car, classify whether a customer will default on a loan product, or recommend ...	1	0	0	2280000
result	40	data science bootcamp	organic	https://www.datasciencegraduateprograms.com/bootcamps/	Data Science Bootcamps | What are Data Science Boot Camps?	Strap on your jump boots and get ready to get smoked: an intensive bootcamp is the fastest way to get your brain up to speed and ready for a career or further education in the field of data science. Candidates aren't rousted out of bed at dawn for a two-mile run and calisthenics at a data science bootcamp, but the use of the ...	1	0	0	2280000
result	41	data science bootcamp	organic	https://datasciencebootcamps.com/	Data Science Bootcamps	Outcomes reports have not been widely embraced by the Data Science Bootcamp community compared to their programming bootcamp brethren. In fact, programming bootcamps are actually leading the vanguard on Outcomes Transparency. Hack Reactor and several other Programming Bootcamps founded The Council ...	1	0	0	2280000
result	42	data science bootcamp	organic	http://ce-online.ryerson.ca/ce/default.aspx?id=3824	Data Science Bootcamp - The Chang School - Ryerson University	Data Science Bootcamp. This five-day Data Science Bootcamp will give participants an introductory foundation in big data analytics, tools, and statistics. Engaging lectures and hands-on activities will explore data analytics skills and the creation of a road map for completion of a successful analytics project. Participants will ...	1	0	0	2280000
result	43	data science bootcamp	organic	https://www.eventbrite.com/e/data-science-bootcamp-at-spark-summit-analyze-data-and-build-a-dashboard-with-spark-notebooks-and-tickets-34859161691	Data Science Bootcamp at Spark Summit: Analyze Data and Build a ...	Jun 7, 2017 - Eventbrite - IBM Watson Data Platform Team presents Data Science Bootcamp at Spark Summit: Analyze Data and Build a Dashboard with Spark, Notebooks and PixieDust - Wednesday, June 7, 2017 at Galvanize San Francisco, San Francisco, CA. Find event and ticket information.	1	0	0	2280000
result	44	data science bootcamp	organic	https://www.fbk.eu/en/event/urban-data-science-bootcamp/	Urban Data Science Bootcamp - FBK	Urban Data Science Bootcamp. A course to discover the Big Data and Data Science techniques applied to your city environment, with the aim of preparing to face the challenges of the Smart Cities of the Future ...	1	0	0	2280000
result	45	data science bootcamp	organic	https://www.youracclaim.com/org/ibm/badge/data-science-bootcamp	Data Science Bootcamp - Acclaim	Data Science Bootcamp. This badge earner understands how to manipulate, visualize and analyze data. The individual is also able to apply machine learning algorithms on small and big data sets. IBM. This badge is issued by IBM ...	1	0	0	2280000
result	46	data science bootcamp	organic	https://orgsync.com/86964/events/1860887/occurrences/4352418	DATA SCIENCE BOOT CAMP @ 2017 | INFORMS @ USF - OrgSync	Mar 9, 2017 - INFORMS@USF invites you to Data Science Boot Camp this year on 24-25 March. We will be teaching application of R and Python to solve case studies and analyze large-scale data. Please see flyer for more info. Register at: https://goo.gl/9vMtQE (Note: RSVP in Bullsync does register you for the event.	1	0	0	2280000
result	47	data science bootcamp	organic	https://simons.berkeley.edu/data-science-2018-boot-camp	Foundations of Data Science Boot Camp | Simons Institute for the ...	Registration is required to attend this Boot Camp. Space may be limited, and you are advised to register early. The link to the registration form will appear on this page approximately 10 weeks before the Boot Camp. To submit your name for consideration, please register and await confirmation of your acceptance before ...	1	0	0	2280000
result	48	data science bootcamp	organic	https://medium.com/@DigitYser/shift-your-career-with-a-data-science-bootcamp-f1d74a656e9b	Shift your career with a Data Science Bootcamp – DigitYser – Medium	Jul 2, 2017 - Marta, Olivier and Agustina share their experience and tips for accomplishing a career change via attending a Data Science Bootcamp The speed in which digitalisation has reshaped the job market has…	1	0	0	2280000
result	49	data science bootcamp	organic	http://pragmaticworks.com/Training/Details/Data-Science-Boot-Camp	Data Science Boot Camp - Pragmatic Works	Cash registers, websites, patients, employees, customers, students, machines, warehouses and nearly every other aspect of the modern business world generate enormous amounts of data. Hiding within these ever-increasing mountains of data are patterns that can optimize nearly every business decision. Knowing how to ...	1	0	0	2280000
result	50	data science bootcamp	organic	http://emap.fgv.br/eventos/introduction-data-science-bootcamp	Introduction to Data Science Bootcamp | EMAp/FGV - Escola de ...	The School of Applied Mathematics will hold from January 15 to 19, 2018, The Introduction to Data Science Bootcamp. Data science has become a central component in most analytical and decision-making processes. This week long bootcamp presents the foundations of data science, providing a broad and solid ...	1	0	0	2280000
result	51	data science bootcamp	organic	https://www.thedataincubator.com/people.html	Data Science Bootcamp Mentors | The Data Incubator	Michael has worked as a data scientist (Foursquare), quant (D.E. Shaw, J.P. Morgan), and a rocket scientist (NASA). He did his PhD at Princeton as a Hertz fellow and read Part III Maths at Cambridge as a Marshall scholar. At Foursquare, Michael discovered that his favorite part of the job was teaching and mentoring smart ...	1	0	0	2280000
result	52	data science bootcamp	organic	https://weclouddata.com/	Data Science & Engineering Training Bootcamp | WeCloudData Toronto	Learn Data Science, Machine Learning and Big Data at WeCloudData to build a strong project portfolio and make a smooth career transition to Data Science.	1	0	0	2280000
result	53	data science bootcamp	organic	https://insightdatascience.com/	Insight Data Science Fellows Program	An intensive 7-week post-doctoral training fellowship bridging the gap between academia & data science. Join top companies working on data science.	1	0	0	2280000
result	54	data science bootcamp	organic	https://datasciencebe.com/tag/bootcamp/	Bootcamp | The Data Science Community	We just finished the most amazing quarter since our creation. We moved to DigitYser, found 2 new supporters with Sofina and the Brussels Region, we launched the second coding camp and datascience bootcamp. Unfortunately we also had to say goodbye to a good friend.	1	0	0	2280000
result	55	data science bootcamp	organic	http://www1.wne.edu/news/2017/08/data-science-bootcamp.cfm	University Announces Partnership with Startup Institute to Deliver Data ...	Aug 22, 2017 - Western New England University's Office of Professional Development is offering a ten-week data science boot camp, Data Science & Analytics, in partnership with Startup Institute, a leading career accelerator for the innovation economy in Boston and New York. The partnership between Startup Institute ...	1	0	0	2280000
result	56	data science bootcamp	organic	https://blogs.oracle.com/datawarehousing/data-scientist-boot-camp-skills-and-training	Data Scientist Boot camp (Skills and Training) | Oracle The Data ...	As almost everyone is interested in data science, take the boot camp to get ahead of the curve. Leverage this free Data Science Boot camp from Oracle Academy to...	1	0	0	2280000
result	57	data science bootcamp	organic	https://data.miami/	Data.Miami – Learn the most in demand skills and advance your career	Join South Florida's 1st Immersive Data Science Bootcamp and gain the analytical skills to excel in your career. LEARN MORE. LEARN. GROW. MASTER DATA SCIENCE. The Data Science Bootcamp – Spring 2018. Course Details. 12- week immersive / Part-time; Starts May 22nd; 2 evening classes a week (6:30-9:30pm) ...	1	0	0	2280000
result	58	data science bootcamp	organic	https://pdxcodeguild.com/pdx_code_financial_aid/	PDX Code Guild - Data Science Bootcamp	PDX Code Guild has partnered with Skills Fund! Skills Fund is a student financing platform that only works with high-quality coding and data science programs - to eliminate any barriers that stand between you and your transformative skills training. In partnership with Skills Fund, we're proud to offer: Tuition & living expense ...	1	0	0	2280000
result	59	data science bootcamp	organic	https://skills.fund/blog/data-science-bootcamps-101	Data Science Bootcamps 101 - Skills Fund: Revolutionizing Higher ...	Aug 24, 2017 - You've heard it everywhere: Data Science is the next big thing. Named as the number one job of 2017 by Glassdoor and with an estimated 28% growth in demand by 2020, Data Science is a hot career choice for technology bootcamp graduates.	1	0	0	2280000
result	60	data science bootcamp	organic	https://www.discoverdatascience.org/programs/data-science-bootcamps/	Data Science Bootcamps | DiscoverDataScience.org	The number of Data Science bootcamps being offered is continuously expanding. Search our complete directory to find the best program for you.	1	0	0	2280000
result	61	data science bootcamp	organic	https://www.analyticsvidhya.com/blog/2015/08/data-science-bootcamps-machine-learning-certifications/	List of Machine Learning Certifications and Best Data Science ...	Aug 20, 2015 - this article highlights the list of machine learning certifications, best data science bootcamps in USA, free resources on machine learning.	1	0	0	2280000
