TYPE	NUMBER	KEYWORD	ORGANIC	URL	TITLE	DESCRIPTION	PAGE	FLAG_HACKED	FLAG_HARMFUL	STAT_RESULTCOUNT
result	237	statistician	organic	https://www.optasports.com/	Opta	This site uses cookies to improve your experience. Find out more by visiting our Privacy policy. Performcontent-logo.png · Optapro-headlogo.png · Omnisport-headlogo.png · Opta logo · Sectors · Broadcast · Media · Sponsors & brands · Betting & gaming · Smart stadia · Rights holders · OptaPro · Broadcast, AR and VR ...	3	0	0	255
result	238	statistician	organic	http://spicerproductions.com/docs/1c7yc.php?kyot=medical-statistician-job-description	medical statistician job description - Spicer Productions	Job description and duties for Biostatistician. The latest Statistics / Statistician Jobs from PharmiWeb.com. See real job descriptions and get the truth The work of medical statisticians ... A career as a medical statistician is multi-faceted and can depend on the ... How do I find a job as a medical statistician? one search.	3	0	0	255
result	239	statistician	organic	http://spectrumm.eu/forum/d8lml.php?dczm=statistician-degree	statistician degree - SPECTRUMM	The Statistical Society has two levels of Professional Accreditation, Graduate Statistician and Accredited Statistician However, some positions are available to those with a bachelors degree. Salaries for What is Professional Accreditation? Find the Online School That Meets Your Needs. Course structure and assessment ...	3	0	0	255
result	240	statistician	organic	http://superti.org/forum/wr8vwu0.php?kyot=statistician-jobs-in-banks	statistician jobs in banks - SuperTI	Get instant job matches for companies hiring now for Statistician jobs in Forth Banks and more. Quantitative Analyst, Senior Quantitative Analyst, Data Warehouse Engineer and more! International development jobs in UN institutions, aid agencies, international NGOs, as well as multilateral, financial, academic and research ...	3	0	0	255
result	241	statistician	organic	http://sainte-therese.csdc.qc.ca/journal/rlj6h.php?kyot=mathematical-statistician-salary	mathematical statistician salary	Government jobs with the Department of Homeland Security (DHS) listed by major occupations and federal Jobs most hired by DHS Want to know what the average statistician salary in the United States is? Over 100 career profiles to help students explore careers in science, technology, engineering, and math.	3	0	0	255
result	242	statistician	organic	http://st-andrewsenf.co.uk/journal/372bvr.php?kyot=where-can-a-statistician-work	where can a statistician work - St Andrew's C of E Primary	A statistician should have excellent interpersonal communication skills. Three statisticians went out hunting, and came across a large deer. August 21, 2017. Actuaries and statisticians work with data. Anytime statistics like 75% of people who smoke develop lung cancer," are heard, one can be sure that the hard work of a ...	3	0	0	255
result	243	statistician	organic	http://guprep.ru/blog/uw1d1d.php?kyot=statistician-salary-uk	statistician salary uk	The average Research Officer Statistician salary in UK is 35,813 per year or 18 per hour. 73 jobs to view and apply for now with Wiley Job Network Statistician jobs, salary information and job satisfaction. 207 Statistician Salaries from anonymous employees in London, UK. Get instant job matches for companies hiring now ...	3	0	0	255
result	244	statistician	organic	http://complex-ilmen.ru/docs/qh0ioqn.php?kyot=what-is-a-statistician-salary	what is a statistician salary	Statistician salary. What salary does a Statistician earn in your area? I was surprised to not see anything relevant in the search for "starting salary" in this sub. According to PayScale, the median pay was $86,703 (20% above the national average). As a statistician develops their skills, their earning potential will generally ...	3	0	0	255
result	245	statistician	organic	http://recwind.com/blog/wlaprpx.php?kyot=hospital-statistician-job-description	hospital statistician job description	Job Description: Statistician/Senior. Data Scientist, Statistician, Research Fellow and more! The Charlotte Mecklenburg Hospital Authority dba Carolinas Healthcare System. Apply to 5343 Hospital statistician Jobs on Monsterindia.com, India's Best Online Job Portal. Statistician. Individuals searching for Biostatistician: Job ...	3	0	0	255
result	246	statistician	organic	http://romana-spandau.de/journal/1tsj2.php?kyot=government-statistician-job-description	government statistician job description - Romana Spandau	Government of the Hong Kong S.A.R. Learn more about working as a statistician / analyst here. Statistical Service Career Employment Vacancy for Government Statistician in Ghana March 2016 Ghana Statistical Service Job Employment Vacancy : Government Job Description. To put it simply, government research officers ...	3	0	0	255
result	247	statistician	organic	http://sofic.it/journal/n9cw5gt.php?kyot=statistician-similar-professions	statistician similar professions	1,359 Statistician jobs available on Indeed.com. Statistician (Economic) Careers Related to Economics A degree in economics offers a variety of career options. By: ... our reports reflect very bright futures for these professions. ... Statistician Forecast trends by analyzing big data. A statistician's median annual salary is about ...	3	0	0	255
result	248	statistician	organic	http://conceitualdistribuidora.com.br/site/8wppr91.php?dczm=government-statistician-jobs	government statistician jobs - Conceitual Distribuidora	one search. Search CareerBuilder for Statistician Jobs and browse our platform. ... government agencies, and academic institutions advertise their statistical job openings. Job Vacancy For Government Statistician At Ghana Statistical Service. Listing jobs in Economics, Econometrics, and Finance. Learn where the best ...	3	0	0	255
result	249	statistician	organic	http://atelieroscar.nl/docs/9feh4b.php?kyot=hospital-statistician-job-description	hospital statistician job description	Apply for the post of Hospital Statistician Vacancy for KSA MOD Hospital in Jesseena Marine Services Pvt Ltd for Saudi Arabia city with 4-8 years ... Job Description. Individuals searching for Biostatistician: Job Description & Career Info found the links, articles, and information on this page helpful. Apply to 293 Statistician ...	3	0	0	255
result	250	statistician	organic	http://tehnokit.by/journal/gg9x3nc.php?kyot=role-of-a-statistician-in-research	role of a statistician in research	Segreti, A. C. (2007, August). Data Scientist, Clinical Research Associate, Researcher and more! The Role of the Statistician in Oncology Research Teams Elizabeth Garrett-Mayer, Ph.D. Associate Professor Hollings Cancer Center Dept. PY - 1978. On Nov 1, 1998 Lynne Billard published: The Role of Statistics and the ...	3	0	0	255
result	251	statistician	organic	http://canarybeauty.vn/docs/7ef9y.php?kyot=statistician-salary-uk	statistician salary uk	63,334 Statistics jobs available on Indeed.com. Jobs in Biostats/biostatistics and pharma statistics, for biostatisticians in biotech & pharma. The UKs No.1 job site is taking the pain out of looking for a job. Browse our collection of Statistician job listings, including openings in full time and part time. 207 Statistician Salaries ...	3	0	0	255
result	252	statistician	organic	http://td-snabstroy.ru/site/68tq7.php?kyot=what-is-a-statistician-salary	what is a statistician salary	High average salary ($84,000 as of May 2014 for all statisticians)*. Because statisticians are employed in so many different kinds of work, in government offices or in scientific, The ASA does a statistics salary survey regularly. The average salary for Priority Dispatch Statistician is $84.3K per year, ranging from $59.3K to ...	3	0	0	255
result	253	statistician	organic	http://accancaster.org/blog/4askh1n.php?kyot=data-crunching-meaning-in-hindi	data crunching meaning in hindi	Define diagnostic: of, relating to, or used in diagnosis; using the methods of or yielding a diagnosis diagnostic in a sentence Put in simple words data crunching is the process of doing several numerical calculations, as an analyst in finance, computer, or a statistician, or a programmer. What is the meaning of Crunching?	3	0	0	255
result	254	statistician	organic	http://teleanke.dk/blog/6fhhowh.php?kyot=ernst-engel	ernst engel	An economic theory introduced in 1857 by Ernst Engel, a German statistician, stating that the percentage of income allocated for Definition of Engel, Ernst Our online dictionary has Engel, Ernst information from International Encyclopedia of the Social Sciences dictionary. Ernest ENGEL-PAK: worldwide auctions of art ...	3	0	0	255
result	255	statistician	organic	http://circumcisionsvancouver.com/docs/k7lvpd.php?kyot=statistics-jobs	statistics jobs	Find freelance Statistics work on Upwork. Statistician is the coolest job youve never heard of. ASA JobWeb. Statistics jobs. Find the best Mathematics And Statistics jobs on Workopolis.com and Apply Now! Data Analyst, Business Analyst, Research Analyst and more! ... Data and Statistics about the United States. all jobs.	3	0	0	255
result	256	statistician	organic	http://niezapominajka.org.pl/blog/mduufj4.php?kyot=what-does-a-statistician-do	what does a statistician do	The other type of sports statistician is a statistical recorder, who attends sporting events and records the data in real ... Not many people do ... Statistician; Collections With This Career up vote 11 down vote favorite. what would you major in if you went to college if you wanted to become a statistician? ... How has the role of ...	3	0	0	255
result	1	data scientist	organic	https://en.wikipedia.org/wiki/Data_science	Data science - Wikipedia	searchbusinessanalytics.techtarget.com	1	0	0	35700000
result	2	data scientist	organic	https://en.wikipedia.org/wiki/Data_science	Data science - Wikipedia		1	0	0	35700000
result	3	data scientist	organic	https://en.wikipedia.org/wiki/Data_science	Data science - Wikipedia	Data science, also known as data-driven science, is an interdisciplinary field of scientific methods, processes, algorithms and systems to extract knowledge or insights from data in various forms, either structured or unstructured, similar to data mining.	1	0	0	35700000
sitelink	1	data scientist	organic	https://en.wikipedia.org/wiki/Business_analytics	Business analytics					
sitelink	2	data scientist	organic	https://en.wikipedia.org/wiki/Information_science	Information science					
sitelink	3	data scientist	organic	https://en.wikipedia.org/wiki/Information_explosion	Information explosion					
sitelink	4	data scientist	organic	https://en.wikipedia.org/wiki/Jim_Gray_(computer_scientist)	Jim Gray					
result	4	data scientist	organic	https://blog.udacity.com/2014/11/data-science-job-skills.html	8 Skills You Need to Be a Data Scientist | Udacity	Nov 7, 2014 - Getting a job in data science is as much about finding a company whose needs match your skills as it is developing those skills.	1	0	0	35700000
result	5	data scientist	organic	http://searchbusinessanalytics.techtarget.com/definition/Data-scientist	What is data scientist? - Definition from WhatIs.com	The education requirements for data scientists typically include a bachelor's degree in statistics, data science, computer science or mathematics. Hard skills required for the job include data mining, machine learning and the ability to integrate structured and unstructured data.	1	0	0	35700000
result	6	data scientist	organic	http://www.mastersindatascience.org/careers/data-scientist/	How to Become a Data Scientist | Data Scientist Salary	The Life of a Data Scientist. Data scientists are big data wranglers. They take an enormous mass of messy data points (unstructured and structured) and use their formidable skills in math, statistics and programming to clean, massage and organize them.	1	0	0	35700000
result	7	data scientist	organic	https://hbr.org/2012/10/data-scientist-the-sexiest-job-of-the-21st-century	Data Scientist: The Sexiest Job of the 21st Century	Meet the people who can coax treasure out of messy, unstructured data.	1	0	0	35700000
result	8	data scientist	organic	https://www.sas.com/en_us/insights/analytics/what-is-a-data-scientist.html	What is a data scientist? | SAS	Why are data scientists in such high demand? Learn who they are, what they do and how they've become such a hot commodity in the tech world.	1	0	0	35700000
result	9	data scientist	organic	https://www.forbes.com/sites/louiscolumbus/2018/01/29/data-scientist-is-the-best-job-in-america-according-glassdoors-2018-rankings/	Data Scientist Is the Best Job In America According Glassdoor's 2018 ...	Jan 29, 2018 - Data Scientist has been named the best job in America for three years running, with a median base salary of $110000 and 4524 job openings. Median base salary of the 50 best jobs in America is $91000 with the average salary of the six analytics and data science jobs being $94167.	1	0	0	35700000
result	10	data scientist	organic	https://www.forbes.com/sites/gilpress/2013/05/28/a-very-short-history-of-data-science/	A Very Short History Of Data Science - Forbes	The story of how data scientists became sexy is mostly the story of the coupling of the mature discipline of statistics with a very young one--computer science. The term “Data Science” has emerged only recently to specifically designate a new profession that is expected to make sense of the vast [...]	1	0	0	35700000
result	11	data scientist	organic	http://www.slate.com/articles/technology/future_tense/2016/02/how_to_bring_better_ethics_to_data_science.html	How to bring better ethics to data science.	In the waning months of the Bloomberg administration, I worked for a time in a New York City Hall data group within the Health and Human Services division. One day, we were given a huge dataset on homeless families, which included various characteristics such as the number and age of children and ...	1	0	0	35700000
result	12	data scientist	organic	http://radar.oreilly.com/2011/09/building-data-science-teams.html	Building data science teams - O'Reilly Radar	Starting in 2008, Jeff Hammerbacher (@hackingdata) and I sat down to share our experiences building the data and analytics groups at Facebook and LinkedIn. In many ways, that meeting was the start of data science as a distinct professional specialization (see the “What makes a data scientist” section of ...	1	0	0	35700000
result	13	data scientist	organic	https://www.datacamp.com/tracks/data-scientist-with-python	Data Scientist with Python Track | DataCamp	Learn Data Science with this collection of tutorials covering data manipulation, data visualization, machine learning and more.	1	0	0	35700000
result	14	data scientist	organic	https://www.coursera.org/specializations/jhu-data-science	Data Science | Coursera	Data Science from Johns Hopkins University. Ask the right questions, manipulate data sets, and create visualizations to communicate results. This Specialization covers the concepts and tools you'll need throughout the entire data science ...	1	0	0	35700000
result	15	data scientist	organic	https://www.cio.com/article/3217026/data-science/what-is-a-data-scientist-a-key-data-analytics-role-and-a-lucrative-career.html	What is a data scientist? A key data analytics role and a lucrative ...	Feb 26, 2018 - Data scientists uncover insights from massive amounts of data to help shape or meet business goals. The data scientist role is becoming increasingly important as businesses rely on data analytics to drive decision-making. Here are the skills, experience, education and training that will help you launch a ...	1	0	0	35700000
result	16	data scientist	organic	https://www.ibm.com/analytics/data-science	Data Science and Advanced Analytics | IBM Analytics	Transform your data into tangible business value with the latest, most flexible and open technology. Enable your data scientists, data engineers, machine learning engineers, and analysts to collaborate with the best-in-class open source tools and visual tools, along with the most flexible and scalable deployment options.	1	0	0	35700000
result	17	data scientist	organic	https://www.edx.org/micromasters/data-science	Data Science | edX	Excel in Data Science, one of the hottest fields in tech today. Learn how to gain new insights from big data by asking the right questions, manipulating data sets and visualizing your findings in compelling ways. In this MicroMasters program, you will develop a well-rounded understanding of the mathematical and ...	1	0	0	35700000
result	18	data scientist	organic	https://www.linkedin.com/jobs/data-scientist-jobs	16,000+ Data Scientist Jobs | LinkedIn	Today's top 16356 Data Scientist jobs in United States. Leverage your professional network, and get hired. New Data Scientist jobs added daily.	1	0	0	35700000
result	19	data scientist	organic	http://www.businessinsider.com/what-its-like-to-be-a-data-scientist-best-job-in-america-2017-9	What it's like to be a data scientist, the best job in America right now ...	Sep 24, 2017 - If you've ever wondered what exactly a "data scientist" is or does, wonder no more.	1	0	0	35700000
result	20	data scientist	organic	https://www.prospects.ac.uk/job-profiles/data-scientist	Data scientist job profile | Prospects.ac.uk	Discover what it takes to be a Data scientist. Find out expected salary, working hours, qualifications and more.	1	0	0	35700000
result	21	data scientist	organic	https://www.springboard.com/workshops/data-science-career-track	Data Science Career Track | Springboard	Data Science Career Track is your springboard to a data science career. Online, mentor-guided bootcamp, designed to get you hired. Get a job, or your money back.	1	0	0	35700000
result	22	data scientist	organic	https://medium.com/towards-data-science/data-science/home	Data Science – Towards Data Science - Medium	2 days ago - Data Science. Sharing concepts, ideas, and codes.	1	0	0	35700000
result	23	data scientist	organic	https://towardsdatascience.com/the-two-sides-of-getting-a-job-as-a-data-scientist-a4571acc58bc	The two sides of Getting a Job as a Data Scientist – Towards Data ...	Feb 26, 2018 - Hello! This is a blog post I've been waiting a lot to write. Mostly because I needed to do my research and listen to what other people have to say about this. I consider myself a Data Scientist, not…	1	0	0	35700000
result	24	data scientist	organic	https://boards.greenhouse.io/snapchat/jobs/534341	Job Application for Data Scientist at Snap Inc. - Greenhouse	We're looking for a Data Scientist to join Snap Inc! Working closely alongside the Engineering, Product Design, and Product Management teams, you will create inventive, data-based approaches to solving difficult business problems. What you'll do: Partner with the Product, Finance, and Engineering teams, and apply your ...	1	0	0	35700000
result	25	data scientist	organic	http://bigdata-madesimple.com/what-is-a-data-scientist-14-definitions-of-a-data-scientist/	What is a data scientist? 14 definitions of a data scientist!	Data scientist is a person who has the knowledge and skills to conduct sophisticated and systematic analyses of data. A data scientist extracts insights fr.	1	0	0	35700000
result	26	data scientist	organic	https://medium.freecodecamp.org/aspiring-data-scientist-master-these-fundamentals-be7c54350868	Aspiring data scientist? Master these fundamentals.	Feb 12, 2018 - Data science is an exciting, fast-moving field to become involved in. There's no shortage of demand for talented, analytically-minded individuals. Companies of all sizes are hiring data scientists, and the role provides real value across a wide range of industries and applications. Often, people's first ...	1	0	0	35700000
result	27	data scientist	organic	https://hackernoon.com/how-to-grow-as-a-data-scientists-f27c9114fefb	How To Grow As A Data Scientist – Hacker Noon	Dec 19, 2017 - The role of a data scientist still varies from company to company and even team to team. This makes it much harder for companies to create a standardized growth plan for their data scientists…	1	0	0	35700000
result	28	data scientist	organic	https://academy.microsoft.com/en-us/professional-program/tracks/data-science/	Online Data Science Courses | Microsoft Professional Program	Opportunities for data scientists—one of today's hottest jobs—are rapidly growing in response to the exponential amounts of data being captured and analyzed. Companies hire data scientists to find insights and to solve meaningful business problems. Get the real-world knowledge and hands-on experience that can help ...	1	0	0	35700000
result	29	data scientist	organic	https://www.udemy.com/topic/data-science/	Top Data Science Courses Online - Updated March 2018 - Udemy	Learn Data Science today: find your Data Science online course on Udemy.	1	0	0	35700000
result	30	data scientist	organic	https://datasciencedegree.wisconsin.edu/data-science/what-do-data-scientists-do/	What Do Data Scientists Do? | University of Wisconsin Data Science	Find out what data scientists do and if the field is right for you. Then ask about a Master's in Data Science degree from the University of Wisconsin.	1	0	0	35700000
result	31	data scientist	organic	https://nubank.workable.com/j/5901B90A55	Data Scientist - Nubank - Jobs: Data Scientist - Apply online - Workable	All jobs → Data Scientist. Data Scientist. São Paulo, State of São Paulo, Brazil · Data Science. Description. Why do we hire data scientists? Nubank is a technology company that has set out to completely rethink financial services in Brazil. We need world-class data scientists (and modelers, statisticians, AI practitioners, ...	1	0	0	35700000
result	32	data scientist	organic	https://insightdatascience.com/	Insight Data Science Fellows Program	An intensive 7-week post-doctoral training fellowship bridging the gap between academia & data science. Join top companies working on data science.	1	0	0	35700000
result	33	data scientist	organic	https://www.airbnb.com/careers/departments/data-science-analytics	Data Science and Analytics Department | Careers at Airbnb	The Data Science/Analytics team helps navigate Airbnb through uncharted waters. We turn hard data into useful insights and compelling stories. From optimizing our site to guiding on-the-ground operations, we love to challenge conventional wisdom, use information to build awesome visualizations, and develop effective ...	1	0	0	35700000
result	34	data scientist	organic	https://www.dropbox.com/jobs/listing/496967	Data Scientist - Dropbox	Work on high priority initiatives including (but not limited to) account prioritization, account prospecting, and opportunity scoring; Instrumentation of propensity modeling: query and process big data: integrate volumes of data from multiple internal and external sources and into Dropbox's systems of record; Partner closely with ...	1	0	0	35700000
result	35	data scientist	organic	https://www.riotgames.com/en/work-with-us/job/13287	Data Scientist | Riot Games	Data Scientist. Los Angeles, USA. Riot Games was established in 2006 by entrepreneurial gamers who believe that player-focused game development can result in great games. In 2009, Riot released its debut title League of Legends to critical and player acclaim. As the most played PC game in the world, over 100 million ...	1	0	0	35700000
result	36	data scientist	organic	https://www.inc.com/minda-zetlin/how-to-land-a-high-paying-data-science-job-even-if-you-have-the-wrong-backgroun.html	How to Land a High-Paying Data Science Job (Even If You Have the ...	Oct 21, 2015 - Would you like to work in a field where average salaries are in the six figures, the potential for raises and promotions is high, demand for employees far outstrips supply, and you can easily start your own business? If all that sounds appealing, consider data science. Glassdoor reports an average salary of ...	1	0	0	35700000
result	37	data scientist	organic	https://www.payscale.com/research/US/Job=Data_Scientist%2C_IT/Salary	Data Scientist, IT Salary - PayScale	As of Feb 2018, the average pay for a Data Scientist, IT is $91074 annually or $36.02 /hr.	1	0	0	35700000
result	38	data scientist	organic	https://www.firstderivatives.com/careers/graduates/data-scientist/	Data Scientist | FD - First Derivatives	First Derivatives plc is currently recruiting for a number of HQ and Overseas roles in our Data Scientist stream. These roles offer candidates a unique opportunity to enter the Big Data world where the emphasis is on problem solving using a combination of analytics, imagination and business understanding. Data Scientists ...	1	0	0	35700000
result	39	data scientist	organic	https://www.adobe.com/careers/data-science.html	Search data science jobs | Adobe careers	Adobe is one of the largest data collection platforms in the world, managing approximately 35 petabytes of customer data and processing one trillion transactions per quarter. But it's not just the quantity of data — it's the quality of the work that makes this an amazing time to be a data scientist at Adobe. Join us to turn data ...	1	0	0	35700000
result	40	data scientist	organic	https://zapier.com/jobs/data-scientist-growth-Q1-2018/	Data Scientist - Growth - Jobs at Zapier | Zapier	Feb 20, 2018 - Hi there! We're looking for a Data Scientist to join the data team at Zapier. Interested in helping grow a product that helps the world automate their work so they can get back to living? Then read on… We know applying for and taking on a new a job at any company requires a leap of faith. We want you to feel ...	1	0	0	35700000
