TYPE	NUMBER	KEYWORD	ORGANIC	URL	TITLE	DESCRIPTION	PAGE	FLAG_HACKED	FLAG_HARMFUL	STAT_RESULTCOUNT
result	159	data scientist	organic	http://www.starlab.es/starlab-neuroscience-data-scientist/	JS2018011501 – Starlab Neuroscience Data Scientist | Starlab ...	Jan 15, 2018 - Starlab, a private R&D company based in Barcelona (Spain) and Oxford (UK), is looking for an exceptional data scientist with a very hands-on attitude to join our neuroscience team. This position is offered within the TECNIO Spring+ Program in its Incoming variant. The successful candidate will work at the ...	2	0	0	35700000
result	160	data scientist	organic	http://barcelonafestivalofsong.com/ejfj/ejebv.php?szr=bcg-gamma-data-scientist-interview	Bcg gamma data scientist interview - Barcelona Festival of Song	This is the classic discussion of why BCG Gamma, who they are, what Jan 31, 2017 1 Boston Consulting Group Consultant (Data Science) At BCG Gamma interview questions and 1 interview reviews. Report of Data Analytics Salary of the Top Companies in India * Accenture's Data Analytics Salary in India: 90% gets a ...	2	0	0	35700000
result	161	data scientist	organic	https://www.clearancejobs.com/jobs/2763034/data-scientist	Data Scientist Jobs in Tampa, Florida - ClearanceJobs	Data Scientist in Tampa, Florida requiring an active security clearance. Find other Booz Allen Hamilton defense and intelligence career opportunities on ClearanceJobs.com.	2	0	0	35700000
result	162	data scientist	organic	https://www.epicpeople.org/data-science-and-ethnography/	Data Science and Ethnography: What's Our Common Ground, and ...	1 day ago - One of us is a data scientist (Tye) and the other an ethnographer (Dawn), both working in industry. We regularly see data science and ethnography conceptualized as polar ends of a research spectrum—one as a crunching of colossal data sets, the other as a slow simmer of experiential immersion.	2	0	0	35700000
result	163	data scientist	organic	https://jobs.fidelity.com/ShowJob/Id/79734/VP-Data-Science-Small-Business-Client-Marketing/	VP Data Science - Small Business Client Marketing Job in Durham ...	Fidelty has a career opportunity for a VP Data Science in Small Business Client Marketing.	2	0	0	35700000
result	164	data scientist	organic	http://www.careerbuilder.com/job/J3Q2D26XN5XZ9QKVKS9	Data Scientist Jobs in San Diego, CA - General Dynamics Information ...	3 hours ago - General Dynamics Health Services / ARMA has an opening for a Data Scientist: The Data Analyst, also referred to as the Data Scientist, shall be proficient at entering, cleaning, and conducting basic data manipulation and analysis. Operating in consultation with program staff and the Government's ...	2	0	0	35700000
result	165	data scientist	organic	https://numer.ai/	Numerai	Earn cryptocurrency in weekly data science tournaments.	2	0	0	35700000
result	166	data scientist	organic	http://datascience.nd.edu/category/data-science-immersions/	Data Science Immersions Archives - University of Notre Dame Data ...	16 hours ago - As the program manager of Notre Dame's online master's in Data Science program, one of my key roles is to be a resource for the students. This role gives me the unique opportunity to hear first-hand from the students about their experiences in the program. Throughout the year, I've heard constructive ...	2	0	0	35700000
result	167	data scientist	organic	https://abg.asso.fr/fr/candidatOffres/show/id_offre/47676	Post doc data scientist - ABG	Jan 11, 2018 - Institut Mines Telecom-TEM. Lieu de travail. Evry - Ile-de-France - France. Champs scientifiques. Informatique; Numérique; Science de la donnée (stockage, sécurité, mesure, analyse). Mots clés. Data scientist, e commerce, modèles prédictifs. Fonction. Enseignement et recherche ...	2	0	0	35700000
result	168	data scientist	organic	https://www.gov.uk/government/publications/senior-data-scientist-skills-they-need/senior-data-scientist-skills-they-need	Senior data scientist: skills they need - GOV.UK	Apr 5, 2017 - What a senior data scientist science does. A senior data scientist is an expert data scientist who provides support and guidance to teams. Senior data scientists: are a recognised authority on a number of data science specialisms within government, with some knowledge of cutting edge techniques; engage ...	2	0	0	35700000
result	169	data scientist	organic	http://independentjobs.independent.co.uk/job/4109525/data-scientist/	Data Scientist job with QinetiQ | 4109525 - Independent Jobs	1 day ago - Data Scientist in Permanent, Competitive, Engineering with QinetiQ. Apply Today.	2	0	0	35700000
result	170	data scientist	organic	http://independentjobs.independent.co.uk/job/4108730/data-scientist-i/	Data Scientist I job with Expedia | 4108730 - Independent Jobs	1 day ago - Data Scientist I in Permanent, Competitive, Technology & New Media with Expedia. Apply Today.	2	0	0	35700000
result	171	data scientist	organic	http://www.gm.com/mol/m-2018-mar-0308-traverse.html	Chevrolet Teams Up With Data Scientist To Create Epic Family Road ...	6 hours ago - DETROIT — Chevrolet enlisted the expertise of prominent data scientist Randy Olson to help families make the most of their spring road trip plans. Olson created a map using a custom algorithm to plan an efficient route through all 48 contiguous states, with stops at 48 of some of the best-known and most ...	2	0	0	35700000
result	172	data scientist	organic	https://www.lebigdata.fr/13-competences-necessaires-devenir-data-scientist	Data Scientist : 13 compétences nécessaires pour exercer ce métier	Jul 20, 2017 - Data Scientist : découvrez les formations, les compétences requises pour exercer ce métier au salaire élevé. Comment accéder à cet emploi à responsabilité ?	2	0	0	35700000
result	173	data scientist	organic	https://jobs.sigmaxi.org/job/staff-data-scientist/39783529/	Staff Data Scientist Job Opening in San Ramon, California - Sigma Xi ...	15 hours ago - A new Staff Data Scientist job is available in San Ramon, California. Check it out on Sigma Xi, The Scientific Research Society's Career Center.	2	0	0	35700000
result	174	data scientist	organic	https://www.leisurejobs.com/job/1754520/data-scientist-farringdon/	Data Scientist - Farringdon job with Tesco | 1754520 - Leisurejobs	3 hours ago - Data Scientist - Farringdon in Financial & Support jobs with Tesco. Apply Today.	2	0	0	35700000
result	175	data scientist	organic	https://www.iimjobs.com/j/data-scientist-bfs-6-11-yrs-549067.html?ref=cl	Data Scientist - BFS (6-11 yrs), Chennai, Big Data,Statistical Modeling ...	4 hours ago - Data Scientist - BFS (6-11 yrs), Chennai, Big Data,Statistical Modeling,Predictive Modeling,Analytics,Data Scientist,Data Science,Data Analytics,SAS,Statistics,Data Visualization,Machine Learning, iim mba jobs - iimjobs.com.	2	0	0	35700000
result	176	data scientist	organic	https://www.bls.gov/ooh/math/mathematicians-and-statisticians.htm	Mathematicians and Statisticians - Bureau of Labor Statistics	Mathematicians and statisticians analyze data and apply mathematical and statistical techniques to help solve real-world problems in business, engineering, healthcare, or other fields.	2	0	0	35700000
result	177	data scientist	organic	https://www.careerjunction.co.za/jobs/view/2196709/lead-data-scientist-in-durban-kwazulu-natal-at-nigel-frank-international	Lead Data Scientist at Nigel Frank International job in Durban ...	1 day ago - Lead Data Scientist at Nigel Frank International job in Durban, KwaZulu-Natal, Market Related basic salary plus benefits Neg, Permanent Senior position.	2	0	0	35700000
result	178	data scientist	organic	https://www.ovoenergy.com/careers/vacancies	Current Vacancies | Come work for OVO - OVO Energy	Got what it takes? Search vacancies for the latest job opportunities at OVO and apply today.	2	0	0	35700000
result	179	data scientist	organic	https://stackoverflow.com/jobs/170230/data-scientist-m-f-xing-se	Data Scientist (m/f) at XING SE - Stack Overflow	XING SE is hiring a Data Scientist (m/f) on Stack Overflow Jobs. Learn more about the Data Scientist (m/f) job and apply now on Stack Overflow Jobs.	2	0	0	35700000
result	180	data scientist	organic	https://sg.jobsdb.com/sg/en/job/contract-data-scientist-for-business-analytics-400003003532561	Singapore Jobs | Contract - Data Scientist for Business Analytics (BA ...	Infineon Technologies Asia Pacific Pte Ltd is hiring Contract - Data Scientist for Business Analytics (BA). qualitative & quantitative. Machine learning. Predictive modelling.	2	0	0	35700000
result	181	data scientist	organic	https://www.theactuaryjobs.com/job/70415/data-scientist-financial-services-newcastle/	Data Scientist - Financial Services - Newcastle job with HFG | 70415	4 hours ago - DATA SCIENTIST Are you passionate of data science and want a hands on technical role? Are you an adept at modelling and want to develop your own tools in an innovative, data-driven company? Our client, a global leader in Financial Services consulting, is looking to taking on a Data Scientist to join ...	2	0	0	35700000
result	182	data scientist	organic	https://www.youtube.com/watch?v=ph439t-kTIE	Data science for the environment | Dan Hammer | TEDxBerkeley ...	Since the industrial revolution, as human technology has advanced, the environment has suffered. Dan Hammer ...	2	0	0	35700000
result	183	data scientist	organic	https://www.nigelfrank.com/sg/vacancy/263647/microsoft-bi-consultant-data-scientist-seattle-wa	Data Scientist - Seattle, WA | Nigel Frank International	4 mins ago - Are you a Data Scientist with an in-depth understanding of statistics, as well as basic programming and data management skills? Do you have strong statistical problem-solving skills and the ability to leverage cutting-edge big data technologies? If so, Apply Below!! Requirements: Advanced knowledge of ...	2	0	0	35700000
result	184	data scientist	organic	http://businessoverbroadway.com/favorite-data-science-and-machine-learning-blogs-podcasts-and-newsletters	Favorite Data Science and Machine Learning Blogs, Podcasts and ...	22 hours ago - Over 16000 data professionals were asked to indicate their favorite data science blogs, podcasts and newsletters. The top two favorite blogs were KDNuggets and R Bloggers. The top two podcasts were Becoming a Data Scientist and The Data Skeptic. The top two newsletters were O'Reilly Data and Data ...	2	0	0	35700000
result	185	data scientist	organic	http://iap.tau.ac.il/job/algorithms-developer-data-scientist/	algorithms developer / data scientist | IAP	algorithms developer / data scientist. Home > algorithms developer / data scientist. Menu. Contact Us. FIND US. Tel Aviv University Tel Aviv, Israel 69971; 03 640-5532 / 03 640-628403 640-5532 / 03 640-6284; 03 640-7221; yaaritr@tauex.tau.ac.il. ABOUT US. IAP is the bridge between the Faculty of Engineering and the Hi ...	2	0	0	35700000
result	186	data scientist	organic	https://www.reddit.com/r/cscareerquestions/comments/82shlq/im_a_data_scientist_with_a_masters_from_an/	I'm a data scientist with a Masters from an excellent University ...	I lurk here a lot, but I feel like I've been having trouble finding posts from other people in similar shoes. I have an excellent academic...	2	0	0	35700000
result	187	data scientist	organic	https://www.jobserve.com/gb/en/search-jobs-in-London,-London,-United-Kingdom/SENIOR-DATA-SCIENTIST-EB5EE0F7BC2DBC2C/?src=06A5C02AE9BD928352	Senior Data Scientist - London - March-08-2018 (FvpYB) - Jobserve	2 hours ago - Senior Data Scientist London London United Kingdom (FvpYB)	2	0	0	35700000
result	188	data scientist	organic	https://www.cv.ee/job-ad/skype-technologies-ou/principal-data-scientist-tallinn-d3554614.html	Job ad - PRINCIPAL DATA SCIENTIST - TALLINN, Tallinn, Full-time ...	5 hours ago - Our good client, SKYPE TECHNOLOGIES OÜ, is seeking for a new team member to fulfill the position of PRINCIPAL DATA SCIENTIST - TALLINN located in TALLINN with working time of FULL-TIME WORK, job ad deadline is 08/04/2018. Apply now!	2	0	0	35700000
result	189	data scientist	organic	https://which-50.com/iapa-recognise-australias-top-data-scientists/	IAPA to recognise Australia's top data scientists - Which-50	4 hours ago - IAPA, the peak body for analytics professionals in Australia, is searching for Australia's top data scientists. Nominations are now open for IAPA's inaugural Top 25 Analytics Leaders program, which aims to recognise best and brightest in Australia's analytics industry. The industry body is looking for ...	2	0	0	35700000
result	190	data scientist	organic	https://blog.panoply.io/women-who-kick-awesome-in-data-2018	Women Who Kick @$$ in Data Analysis, Science and Engineering	18 hours ago - Profiles of 37 women in data analysis, science and engineering who were nominated for recognition of their contributions and initiatives in data.	2	0	0	35700000
result	191	data scientist	organic	https://tyopaikat.oikotie.fi/avoimet-tyopaikat/senior-data-scientist-espoo/1112665	SENIOR DATA SCIENTIST, Espoo, Experis - Oikotie Työpaikat	SENIOR DATA SCIENTIST, Espoo Experis. Alkuperäinen julkaisupäivä 8.3.2018. Experis™ is the global leader in professional resourcing and project based workforce solutions. We attract, assess and place specialist professional talent, connecting the passion of individuals with the ambition of business. We specialize in ...	2	0	0	35700000
result	192	data scientist	organic	https://www.cpjobs.com/hk/job/data-scientist-data-analytics-ref-cojy-da-ds-2139512	Data Scientist - Data Analytics (Ref: COJY-DA-DS) Job at SOUTH ...	View the job description for data scientist - data analytics (ref: cojy-da-ds) job at south china morning post publishers ltd. Apply now to beat the competition.	2	0	0	35700000
result	193	data scientist	organic	https://www.eurojobs.com/switzerland/job/8246992/senior-data-scientist-digital-transformation-geneva.html	Eurojobs.com: Senior Data Scientist- Digital Transformation!, Geneva	4 hours ago - The Digital revolution is upon us! Are you a Data Scientist looking to develop your career with a company where you can make an impact? If yes, read on! I am working closely with an established insurance company in Switzerland who are exploring new effective ways to transform the business. In tandem ...	2	0	0	35700000
result	194	data scientist	organic	https://jobs.rbc.com/ca/en/job/RBCAA008839996/Senior-Data-Scientist	Senior Data Scientist in Toronto, Ontario, Canada | Technology at RBC	Apply for Senior Data Scientist job with RBC in Toronto, Ontario, Canada. Technology at RBC.	2	0	0	35700000
result	195	data scientist	organic	https://www.hirist.com/j/data-scientist-java-c-iit-1-8-yrs-306079.html?ref=kp	Data Scientist - Java/C++ - IIT - Hirist	7 hours ago - Data Scientist - Java/C++ - IIT (1-8 yrs), Delhi/NCR, Data Management,C++,Java,Data Structure,Algorithm,PhD,Data Scientist, tech it jobs - hirist.com.	2	0	0	35700000
result	196	data scientist	organic	https://www.theladders.com/job/data-scientist-gatehouse-media-inc-boston-ma_36186583	Data Scientist - Boston, MA - GateHouse Media Inc. | Ladders	4 hours ago - The team you'll be joining is a small, self-organized group focused on solving challenging data science problems. The current team is composed of a full time data scientist, a full time data engineer, and a part-time data scientist. ThriveHive is full of talented people who love their craft and a leadership that ...	2	0	0	35700000
result	197	data scientist	organic	https://www.theladders.com/job/staff-data-scientist-intuit-plano-tx_36184634	Staff Data Scientist - Plano, TX - Intuit | Ladders - The Ladders	7 hours ago - Staff Data Scientist job in Plano, TX Intuit - Ability to quickly understand patterns within large quantity of data and to reference key characteristics using visualization techniques.	2	0	0	35700000
result	198	data scientist	organic	https://www.theladders.com/job/staff-data-scientist-intuit-plano-tx_36184743	Staff Data Scientist - Plano, TX - Intuit | Ladders - The Ladders	7 hours ago - Staff Data Scientist job in Plano, TX Intuit - Provides consultative guidance across businesses on how best to utilize data for business decision-making, and to build the organization mind-set and capabilities needed to fully exploit this data as an asset.	2	0	0	35700000
result	199	data scientist	organic	http://www.jobs.ac.uk/job/BIG721/research-associate-fellow-data-scientist-statistician-in-primary-care-epidemiology-fixed-term-med463117x1/	Research Associate/Fellow (Data Scientist/Statistician) in Primary ...	8 hours ago - View details for this Research Associate/Fellow (Data Scientist/Statistician) in Primary Care Epidemiology (Fixed-term) MED463117X1 job vacancy at...	2	0	0	35700000
result	200	data scientist	organic	https://www.mediaupdate.co.za/marketing/143526/why-businesses-need-data-scientists	Why businesses need data scientists - Media Update	6 hours ago - Data scientists extract insights from Big Data that businesses can use to drive efficiency, innovation, and growth. Their work, which is supported by data analysts and engineers, uncovers knowledge that helps companies stay competitive.	2	0	0	35700000
result	201	data scientist	organic	http://www.professionalconsulting.es/ytk7/6nbvp.php?szr=mckinsey-data-scientist	Mckinsey data scientist - Professional Consulting	As a Data Scientist, you will work through our clients' entire data ecosystem to understand what's. ) heavily invest in data science expertise, especially after the talk from Philip Evans Senior Data Scientist - Journey Analytics: McKinsey & Company, Inc. Visualisez les offres d'emploi et décidez si elles vous conviennent en ...	2	0	0	35700000
result	202	data scientist	organic	https://uncw.edu/datascience/	M.S. in Data Science: UNCW Analytics - UNC Wilmington	Data Science Program News. CALL FOR PRACTICUM SPONSORS! For more information click here. SAS super freqs. Team Selected for SAS Global Forum. Congratulations to UNCW DSC Team -SAS Super Freqs- on being selected as one of the eight finalists for the Student Symposium at the 2018 SAS Global Forum.	3	0	0	35600000
result	203	data scientist	organic	https://jobs.fidelity.com/ShowJob/Id/115626/Principal-Data-Scientist-Artificial-Intelligence,-Machine-Learning-Big-Data	Principal Data Scientist - Artificial Intelligence, Machine Learning & Big ...	Fidelty has a career opportunity for a Principal Data Scientist in Artificial Intelligence, Machine Learning & Big Data.	3	0	0	35600000
result	204	data scientist	organic	http://www.afconsult.com/en/join-us/available-jobs/8561-data-scientist/	Data Scientist - Join Us - ÅF - AF Consult	Data Scientist. About the company. ÅF is an engineering and design company within the fields of energy, industry and infrastructure. We create sustainable solutions for the next generation through talented people and technology. We are based in Europe and our business and clients are found all over the world. ÅF Making ...	3	0	0	35600000
result	205	data scientist	organic	https://www.theguardian.com/careers/2015/jun/30/whats-a-data-scientist-and-how-do-i-become-one	What's a data scientist and how do I become one? | Guardian Careers ...	Jun 30, 2015 - There is currently a shortage of data scientists – with companies looking for programmers and analytical thinkers to plug the gap.	3	0	0	35600000
result	206	data scientist	organic	https://careers.boozallen.com/en-US/page/data-science	Data Science & Analytics Careers - Booz Allen Hamilton	In the future, we believe everyone will be a data scientist and we're already thousands strong. We invest heavily in our analytics experts through funding, training, and mentorship. You'll work on a steady stream of interesting projects, support diverse clients, and participate in programs like hackathons and our new Data ...	3	0	0	35600000
result	207	data scientist	organic	https://careers.webmd.com/job-details/data-scientist/13234/1/	Data Scientist Job in New York, NY for WebMD | Market Research ...	Search for Market Research & Analytics Jobs at WebMD | Data Scientist in New York, NY.	3	0	0	35600000
result	208	data scientist	organic	https://cymercareers.com/jobs/data-scientist-879	Data Scientist - Cymer Careers	The Data Scientist role is responsible for modeling complex problems and identifying opportunities through the use of statistical, algorithmic, mining and visualization techniques. In addition to advanced analytic skills, this role is also proficient at integrating and preparing large, varied datasets, utilizing multiple databases ...	3	0	0	35600000
result	209	data scientist	organic	http://www.pacific.edu/Academics/Schools-and-Colleges/School-of-Engineering-and-Computer-Science/Academics-/Graduate-Programs/MS-in-Data-Science.html	Master of Science in Data Science - University of the Pacific	Pacific's MS in Data Science is proud to offer top-quality education and training for the next generation of data scientists, and to be a partner and resource for their current and prospective employers.	3	0	0	35600000
result	210	data scientist	organic	https://www.analyticsvidhya.com/blog/2018/01/10-data-science-machine-learning-ai-podcasts-must-listen/	10 Data Science, Machine Learning and AI Podcasts You Must Listen To	Jan 21, 2018 - With the rapid pace at which technology is driving innovation in machine learning and artificial intelligence, it has become immensely important to keep pace with the ongoing trends in data science. However, it can become challenging to read everything that's out there. Podcasts are a great alternative to ...	3	0	0	35600000
result	211	data scientist	organic	https://www.va.gov/oaa/specialfellows/programs/sf_bdstep.asp?p=24	Big Data-Scientist Training Enhancement Program (BD-STEP) - Office ...	Dec 14, 2017 - The Big Data-Scientist Training Enhancement Program (BD-STEP) was launched by the Department of Veterans Affairs (VA), in collaboration with the National Cancer Institute (NCI), on September 28, 2015.	3	0	0	35600000
result	212	data scientist	organic	https://www.computerworld.com/article/3174724/it-careers/it-job-spotlight-data-scientist.html	IT job spotlight: Data scientist | Computerworld	Feb 27, 2017 - Data scientists are in demand and handsomely paid. Here's what you need to know about this hot IT job.	3	0	0	35600000
result	213	data scientist	organic	https://www.nytimes.com/2014/08/18/technology/for-big-data-scientists-hurdle-to-insights-is-janitor-work.html	For Big-Data Scientists, 'Janitor Work' Is Key Hurdle to Insights - The ...	Aug 17, 2014 - Technology revolutions come in measured, sometimes foot-dragging steps. The lab science and marketing enthusiasm tend to underestimate the bottlenecks to progress that must be overcome with hard work and practical engineering. The field known as “big data” offers a contemporary case study.	3	0	0	35600000
result	214	data scientist	organic	https://www.simpli.fi/data-scientist/	Data Scientist |Simpli.fi Jobs - Careers	Job Description Simpli.fi is looking for experienced, analytically minded individuals to expanding their data science team. If you are interested you will.	3	0	0	35600000
result	215	data scientist	organic	http://blog.wolfram.com/2017/10/10/building-the-automated-data-scientist-the-new-classify-and-predict/	Building the Automated Data Scientist: The New Classify and Predict ...	Oct 10, 2017 - Automated Data Science. Imagine a baker connecting a data science application to his database and asking it, “How many croissants are we going to sell next Sunday?” The application would simply answer, “According to your recorded data and other factors such as the predicted weather, there is a 90% ...	3	0	0	35600000
result	216	data scientist	organic	https://www.dpdhl.jobs/job/bonn/junior-data-scientist-m-w/1886/6015347	Junior Data Scientist (m/w) at Deutsche Post DHL in Bonn | Careers at ...	Oct 18, 2017 - Find out more about the Junior Data Scientist (m/w) role in Bonn at Deutsche Post DHL and apply online now.	3	0	0	35600000
result	217	data scientist	organic	http://contentmarketinginstitute.com/2017/11/marketers-data-scientists/	Why Marketers Need to Think Like Data Scientists (And How to Do It)	Nov 16, 2017 - Work with a data scientist or at least think like one to be able to say “I know,” not “I think” and gain respect of execs – Content Marketing Institute.	3	0	0	35600000
result	218	data scientist	organic	https://catalyst.nejm.org/case-data-scientists-inside-health-care/	Using It or Losing It? The Case for Data Scientists Inside Health Care	May 4, 2017 - Health care needs to “own” its valuable data by investing in data scientists and appropriate internal analytics functions — or risk ceding to outsiders.	3	0	0	35600000
result	219	data scientist	organic	https://www.kohlsoncampus.com/associate-data-scientist	Kohl's Technology | Associate Data Scientist	Solve and create data models and algorithms from huge volumes of data and have a real-world impact on our business.	3	0	0	35600000
result	220	data scientist	organic	https://opensource.com/article/17/9/data-scientist	How to become a data scientist | Opensource.com	Sep 13, 2017 - Once upon a time, I wanted to be an evolutionary biologist. To make a long story short, I had a change of heart and dropped out of my PhD program to pursue a career in computer science. I'm now a senior software engineer at Red Hat, where I work on a variety of machine learning and data science ...	3	0	0	35600000
result	221	data scientist	organic	http://drewconway.com/zia/2013/3/26/the-data-science-venn-diagram	The Data Science Venn Diagram — Drew Conway	Sep 30, 2010 - On Monday I—humbly—joined a group of NYC's most sophisticated thinkers on all things data for a half-day unconference to help O'Reily organize their upcoming Strata conference. The break out sessions were fantastic, and the number of people in each allowed for outstanding, expert driven, discussions ...	3	0	0	35600000
