TYPE	NUMBER	KEYWORD	ORGANIC	URL	TITLE	DESCRIPTION	PAGE	FLAG_HACKED	FLAG_HARMFUL	STAT_RESULTCOUNT
result	121	statistician	organic	http://www.synonym.com/synonyms/statistician	Synonyms and Antonyms for statistician | Synonym.com	2. statistician (n.) someone versed in the collection and interpretation of numerical data (especially someone who uses statistics to calculate insurance premiums). Synonyms: computer · surveyor · estimator · figurer · reckoner · actuary · calculator. Antonyms: software. Did You Know?	2	0	0	11400000
result	122	statistician	organic	https://www.economist.com/news/science-and-technology/21716600-joy-stats-swedish-accent-hans-rosling-statistician-and	Hans Rosling, statistician and sword-swallower, has died - Obituary	Feb 9, 2017 - Besides being a statistician, he was also a doctor with experience in some of the world's poorest corners. He did his PhD in Africa, studying a disease called konzo that strikes people whose diets include a lot of semi-processed cassava, which contains high levels of cyanide. But it was his flair for the ...	2	0	0	11400000
result	123	statistician	organic	https://www.mightyrecruiter.com/job-descriptions/statistician/	Professional Statistician Job Description Template | MightyRecruiter	The work of statisticians involves managing large quantities of data. They may design surveys and polls to gather information about a particular topic. These professionals are concerned with randomly sampling their target audience to get realistic sample representations of entire populations. They interpret data and may ...	2	0	0	11400000
result	124	statistician	organic	https://jobs.medtronic.com/jobs/statistician-32208	Statistician - Medtronic Careers	Aug 7, 2017 - POSITION DESCRIPTION:This position is in Medtronic's MITG Quality organization. The incumbent will join a team of statisticians / business analysts...	2	0	0	11400000
result	125	statistician	organic	http://pixelpeople.wikia.com/wiki/Statistician	Statistician | Pixel People Wiki | FANDOM powered by Wikia	Statistician is a type of profession. You must have the Secret Hideout building before you can...	2	0	0	11400000
result	126	statistician	organic	https://exputec.com/wp-content/uploads/2018/01/Bioprocess-Data-Scientist-EN.pdf	Sr. Bioprocess Statistician - Exputec	Exputec is a technology company based in Vienna that produces and sells Software and Consulting solutions in the field of Biotechnology. Our innovative methods are based on discovering interdependencies which lead to a reduction of the process development time, heightened confidence in scalability, and an increase ...	2	0	0	11400000
result	127	statistician	organic	http://hosppeds.aappublications.org/content/6/12/750	Collaborating With a Statistician: Bringing a Clinical Perspective to ...	Peruse the author lists of articles in any medical journal, and you will quickly appreciate that research is performed by teams. Similar to any team that you might encounter in sports, there is a distribution of labor among the research team members that makes them operate effectively and efficiently. Although statisticians are ...	2	0	0	11400000
result	128	statistician	organic	https://careers.lilly.com/search-jobs/statistician/410/1	Results for statistician Jobs at Lilly - Eli Lilly	Explore job opportunities with Lilly and how you can make life better for people around the world.	2	0	0	11400000
result	129	statistician	organic	https://www.randstadusa.com/jobs/search/q-it-statistician/	It Statistician Jobs | Randstad USA	Jobs 1 - 10 of 1433 - Find new it statistician jobs at Randstad. We have it statistician jobs, including temporary and permanent positions to help you reach your career goals.	2	0	0	11400000
result	130	statistician	organic	http://healthpolicy.ucla.edu/about/Employment/Documents/chis-statistician-jan2018.pdf	employment opportunity statistician - UCLA Center for Health Policy ...	The UCLA Center for Health Policy Research (the Center) has an outstanding opportunity for. Statistician. The Center, which was established in 1994, is based in the School of Public Health and is the premier source of health policy information for California. The Center is one of the nation's leading health policy research ...	2	0	0	11400000
result	131	statistician	organic	https://chroniclevitae.com/jobs/0000412793-01	Statistician | ChronicleVitae	Feb 15, 2018 - University of Idaho Statistician Location: Moscow Division/College: Col of Agricultural & Life Sciences Employee Category: Exempt Pay Range: $64,632 per year or higher depending on experience. Full/Part Time: Full Time Position Summary: Position provides consulting, computer programming and ...	2	0	0	11400000
result	132	statistician	organic	http://isi-iass.org/home/services/the-survey-statistician/	The Survey Statistician - International Association of Survey Statisticians	The Survey Statistician, the journal of the Association, is issued twice a year. It includes general information about the activities of the Association (meetings, seminars, etc.) and about meetings arranged by other organizations around the world that are likely to be of interest to its members. It also includes various technical ...	2	0	0	11400000
result	133	statistician	organic	http://jobs.micron.com/job/Xi&apos;an-MXA-Statistician-61/409984600/	MXA Statistician - Jobs at Micron - Micron Technology, Inc.	Aug 26, 2017 - Xi'an MXA Statistician - 61.	2	0	0	11400000
result	134	statistician	organic	https://projecteuclid.org/euclid.aos/1176346785	Rubin : Bayesianly Justifiable and Relevant Frequency Calculations ...	A common reaction among applied statisticians is that the Bayesian statistician's energies in an applied problem must be directed at the a priori elicitation of one model specification from which an optimal design and all inferences follow automatically by applying Bayes's theorem to calculate conditional distributions of ...	2	0	0	11400000
result	135	statistician	organic	https://www.takedajobs.com/job/zurich/lead-epidemiologist-and-statistician/1113/6398217	Lead Epidemiologist & Statistician Description at Takeda ...	Learn more about applying for Lead Epidemiologist & Statistician at Takeda Pharmaceuticals.	2	0	0	11400000
result	136	statistician	organic	https://jobs.monsanto.com/job/st-louis/applied-statistician-global-technology-development/769/6307872	Applied Statistician - Global Technology Development at MONSANTO	Nov 21, 2017 - Monsanto's Global Technology Development & Agronomy organization is seeking a highly motivated Applied Statistician to support our business in Europe and Asia/Africa, with the role being located in St. Louis. The successful candidate will be responsible for the design and analysis of our commercial ...	2	0	0	11400000
result	137	statistician	organic	https://www.ft.com/content/31995e48-6073-11e6-b38c-7b39cbb1138a	Greek statistician Andreas Georgiou hits back at criminal charges	Aug 14, 2016 - The case has sparked outrage from economists and statisticians worldwide who believe Mr Georgiou has become a scapegoat for Greece's political class, which refuses to accept responsibility for the country's financial collapse or take ownership of a bitterly contested seven-year programme of fiscal and ...	2	0	0	11400000
result	138	statistician	organic	https://reason.com/blog/2017/10/04/a-statistician-reconsiders-her-support-f	A Statistician Reconsiders Her Support for Gun Control After Looking ...	Oct 4, 2017 - "My colleagues and I at FiveThirtyEight spent three months analyzing all 33,000 lives ended by guns each year in the United States," Leah Libresco, a statistician who used to work for the data journalism site, writes in The Washington Post. "We looked at what interventions might have saved those people, ...	2	0	0	11400000
result	139	statistician	organic	https://www.preventioninstitute.org/about/jobs/statistician-public-health-institute	Statistician, Public Health Institute | Prevention Institute	Statistician, Public Health Institute. The Public Health Institute (PHI) is an independent, nonprofit organization dedicated to promoting health, well-being and quality of life for people throughout California, across the nation and around the world. As one of the largest and most comprehensive public health organizations in the ...	2	0	0	11400000
result	140	statistician	organic	https://careers.insidehighered.com/job/1511175/statistician/	Statistician job with University of Kentucky | 1511175	Feb 28, 2018 - Statistician in with University of Kentucky. Apply Today.	2	0	0	11400000
result	141	statistician	organic	https://flowingdata.com/2010/03/04/think-like-a-statistician-without-the-math/	Think Like a Statistician – Without the Math | FlowingData	Mar 4, 2010 - I call myself a statistician, because, well, I'm a statistics graduate student. However, ask me specific questions about hypothesis tests or required sampling size, and my answer probably won't be very good. The other day I was trying to think of the last time I did an actual hypothesis test or formal analysis.	2	0	0	11400000
result	142	statistician	organic	https://www.dartmouth.edu/~chance/teaching_aids/melinda.html	Interview a Statistician - Dartmouth College	Interview a Statistician. This idea came from Ellen Rehak of Gainesville College who was my Chance Workshop roommate last year (June '97). At her school the students find statisticians on their own. Since my students are typically younger and probably less experienced in approaching companies or organizations to ask ...	2	0	0	11400000
result	143	statistician	organic	https://www.careermatch.com/job-prep/career-insights/profiles/sports-statistician/	Sports Statistician Salary and Career Advice | Chegg CareerMatch	“His batting average is 300!” “His shooting averages 40%.” When it comes to sports, it seems that every moment is recorded in the Statistician books. And it's all thanks to the Sports Statistician. That's because the Sports Statistician's job is to watch every moment, follow the calls of the Referee, and make an accurate record ...	2	0	0	11400000
result	144	statistician	organic	https://careers.stryker.com/en-US/search?keywords=Statistician	Statistician Jobs at Stryker	View all Statistician Jobs at Stryker. Search, apply or sign up for job alerts at Stryker Talent Network.	2	0	0	11400000
result	145	statistician	organic	http://jobs.shrm.org/jobs/results/Washington,+District+of+Columbia?job-title=Statistician	Statistician Jobs | SHRM's HR Jobs	SHRM's HR Jobs - Search For Statistician Jobs In Washington, District Of Columbia.	2	0	0	11400000
result	146	statistician	organic	http://www.workjoke.com/statisticians-jokes.html	Statisticians Jokes at WorkJoke.com - Profession Jokes	Three statisticians went out hunting, and came across a large deer. The first statistician fired, but missed, by a meter to the left. The second statistician fired, but also missed, by a meter to the right. The third statistician didn't fire, but shouted in triumph, "On the average we got it!" ...	2	0	0	11400000
result	147	statistician	organic	https://dchr.dc.gov/page/statistician-criminal-justice-coordinating-council	Statistician, Criminal Justice Coordinating Council | dchr	Overview. The Government of the District of Columbia is seeking a Statistician. The position is located in the District of Columbia Criminal Justice Coordinating Council (CJCC). This position functions as senior Statistician, responsible for the management and maintenance of the DC Statistical Analysis Center; and ...	2	0	0	11400000
result	148	statistician	organic	https://listings.jobs.vt.edu/postings/81273	VT Applicant Portal | Statistician	Jul 17, 2017 - Working Title: Statistician. Faculty Rank: To Be Determined. Posting Number: TR0170087. About Virginia Tech: Virginia Tech is a public land-grant university, committed to teaching and learning, research, and outreach to the Commonwealth of Virginia, the nation, and the world. Building on its motto of Ut ...	2	0	0	11400000
result	149	statistician	organic	https://www.opm.gov/policy-data-oversight/classification-qualifications/general-schedule-qualification-standards/1500/statistics-series-1530/	Statistics Series 1530 - OPM	Statistics Series, 1530. Individual Occupational Requirements. Basic Requirements: Degree: that included 15 semester hours in statistics (or in mathematics and statistics, provided at least 6 semester hours were in statistics), and 9 additional semester hours in one or more of the following: physical or biological sciences, ...	2	0	0	11400000
result	150	statistician	organic	http://jobs.grantthornton.com/jobs/1625134-Statistician.aspx	Statistician Job in Washington, District of Columbia 038857 Grant ...	Nov 6, 2017 - Job Description for Statistician in Washington, District of Columbia - Grant Thornton 038857.	2	0	0	11400000
result	151	statistician	organic	https://jobs.grainger.com/Grainger/job/LAKE-FOREST-Sr-Pricing-Statistician-IL-600455202/448766300/	Sr. Brand Pricing Statistician - Grainger Jobs	LAKE FOREST Sr. Brand Pricing Statistician - IL, 600455202.	2	0	0	11400000
result	152	statistician	organic	https://www.cityofhope.org/multimedia/profiles-city-of-hope-leslie-bernstein-the-statistician	Profiles @Hope: Leslie Bernstein, The Statistician | Beckman ...	Oct 19, 2017 - City of Hope's Leslie Bernstein, Ph.D., best known for a seminal study about breast cancer and physical activity, started out wanting to be a baseball statistician. This is a profile of a leading public health expert.	2	0	0	11400000
result	153	statistician	organic	https://www2.umf.maine.edu/merrillcenter/student-employment/job-classifications/statistician/	Statistician | Merrill Center Student Services	Statistician | Merrill Center Student Services. Pay Level I. STATEMENT OF THE JOB: Employee performs routine tasks related to charting statistics of sporting events. Work is performed under direct supervision and requires little use of independent judgment and initiative. Some knowledge of sport preferred. DUTIES:.	2	0	0	11400000
result	154	statistician	organic	https://mahec.applicantpro.com/jobs/696237.html	STATISTICIAN - Asheville, NC - Mountain Area Health Education ...	MAHEC seeks to fill a part-time (20 hour/week) position of Statistician to join our Division of Research. The Statistician is responsible for providing advan.	2	0	0	11400000
result	155	statistician	organic	https://jobs.jnj.com/jobs/00001BBQ?lang=en-us	Apply For Johnson & Johnson Graduate Statistician Programme 2018 ...	Graduate Statistician Programme. Duration: 2 years. Location:Inverness, Scotland. Sector:Medical Devices. What type of mark will you make? Your unique talents and perspective can make a vital contribution to innovative products that improve the lives of people everywhere. Career opportunities within Johnson & Johnson ...	2	0	0	11400000
result	156	statistician	organic	https://www.jobs.net/jobs/jdpower/en-us/job/United-States/Senior-Statistician/J3T0MX63C16PZW4XRR8/	Senior Statistician at J.D. Power - Jobs.net	Feb 8, 2018 - J.D. POWER. Be where the voice of the consumer meets the value of the brand. AtJ.D. Power, you'll be at the heart of commerce, working for a worldwideleader whose intelligence and insights are shaping the way people sell, and theway people buy. Title: Senior Statistician. Location: Westlake Village, CA.	2	0	0	11400000
result	157	statistician	organic	https://www.nku.edu/~longa/public_html/htmls/statjokes.html	Statistical Humor	Statistical Humor. "Three statisticians go deer hunting with bows and arrows. they spot a big buck and take aim. One shoots and his arrow flies off three metres to the right. The second shoots and his arrow flies off three metres to the left. The third statistician jumps up and down yelling; We got him! We got him!" Two unbiased ...	2	0	0	11400000
result	158	statistician	organic	https://careers.mathematica-mpr.com/job/chicago/survey-statistician/727/7140576	Survey Statistician at Mathematica Policy Research	Learn more about applying for Survey Statistician at Mathematica Policy Research.	2	0	0	11400000
result	159	statistician	organic	https://www.earnmydegree.com/how-to-become/statistician-research-analyst	How to Become a Statistician - EarnMyDegree - EarnMyDegree.com	Learn how to become a statistician! Read insights from professionals, learn about skills you should have, career hurdles, FAQS and more. Here at EarnMydegree.com.	2	0	0	11400000
result	160	statistician	organic	https://jobs.advocatehealth.com/job/downers-grove/statistician/33/5015909	Statistician Description at Advocate Health Care	Learn more about applying for Statistician at Advocate Health Care.	2	0	0	11400000
result	161	statistician	organic	https://www.jobaps.com/MD/sup/bulpreview.asp?R1=17&R2=002603&R3=0001	Job Announcement: RESEARCH STATISTICIAN I - State of Maryland	The Science Services Administration, Water Quality Protection and Restoration Program is recruiting for a Research Statistician I. This is a position specific recruitment for the Maryland Department of the Environment. This recruitment will be used to fill current and future vacancies for this position/function only. The resulting ...	2	0	0	11400000
result	162	statistician	organic	https://www.portlandoregon.gov/bhr/article/661325	Statistician - The City of Portland, Oregon	Statistician Classification Specification. Page 1. City of Portland. CLASS SPECIFICATION. STATISTICIAN. [CLASS CODE]. [ESTABLISHED DATE]. CLASSIFICATION SUMMARY. Reports to a Manager or other management-level position. Under minimal supervision, performs complex statistical analyses, utilizes various ...	2	0	0	11400000
result	163	statistician	organic	http://federalgovernmentjobs.us/job-search/statistician-1530.html	Statistician Jobs	53 Jobs - Supervisory Survey Statistician Census Kbl, SUITLAND, MD, Gov, Commerce, 03/04/18, 03/15/18. Supervisory Survey Statistician Census Kbl, DISTRICT OF COLUMBIA, Gov, Commerce, 03/04/18, 03/15/18. Supervisory Survey Statistician Census De Kbl, SUITLAND, MD, Pub, Commerce, 03/04/18, 03/15/18.	2	0	0	11400000
result	164	statistician	organic	https://www.ranker.com/list/famous-female-statisticians/reference	Famous Female Statisticians | List of Top Female Statisticians - Ranker	List of famous female statisticians, listed by their level of prominence with photos when available. This greatest female statisticians list contains the most prominent and top females known for being statisticians. There are thousand of females working as statisticians in the world, but this list highlights only the most notable ...	2	0	0	11400000
result	165	statistician	organic	https://corningjobs.corning.com/CW/job/Corning-Industrial-Statistician-NY-14830/418153600/	Industrial Statistician - Corning	Industrial Statistician. Date: Feb 4, 2018. Location: Corning, NY, US, 14830. Req #: 629. Corning is one of the world's leading innovators in materials science. For more than 160 years, Corning has applied its unparalleled expertise in speciality glass, ceramics, and optical physics to develop products that have created new ...	2	0	0	11400000
result	166	statistician	organic	https://www.dailywire.com/news/21900/statistician-who-championed-stringent-gun-control-hank-berrien	Statistician Who Championed Stringent Gun Control Now Argues ...	Oct 3, 2017 - Writing in The Washington Post, Leah Libresco, a statistician and former newswriter at FiveThirtyEight, the site run by famed statistician Nate Silver, admits that she reversed herself on gun control, evolving from blaming the NRA for gun deaths to realizing more stringent, blanket gun control was not an ...	2	0	0	11400000
result	167	statistician	organic	https://www.statnews.com/2016/07/29/biostatistician-statistics-science/	A statistician's death, and unsung role of statistics in science	Jul 29, 2016 - In reflecting on the legacy of Howard Barkan, I've been reminded of the valuable, and underappreciated, role of statisticians in keeping science honest.	2	0	0	11400000
result	168	statistician	organic	https://careers.c3isolutions.com/job/Upper-Gwynedd-Statistician-PA/455002800/	Statistician - Careers - C3i Solutions	Statistician. Location: Upper Gwynedd, PA, US. Category: Reporting & Analytics. Travel: None. At C3i Solutions, we are committed to providing an incredible experience — that starts with you. When you join our team, you become part of a network across the world delivering solutions for the most trusted healthcare brands, ...	2	0	0	11400000
result	169	statistician	organic	https://bmcmedresmethodol.biomedcentral.com/articles/10.1186/s12874-016-0172-9	Data sharing and the evolving role of statisticians | BMC Medical ...	Jul 8, 2016 - Data sharing and the evolving role of statisticians. Nick ManamleyEmail author,; Steve Mallett,; Matthew R. Sydes,; Sally Hollis,; Alison Scrimgeour,; Hans Ulrich Burger and; Hans-Joerg Urban. BMC Medical Research MethodologyBMC series – open, inclusive and trusted201616(Suppl 1):75.	2	0	0	11400000
result	170	statistician	organic	https://occupationalinfo.org/02/020167026.html	020.167-026 - STATISTICIAN, APPLIED (profess. & kin.) - DOT ...	020.167-026 - STATISTICIAN, APPLIED (profess. & kin.) - DOT Dictionary of Occupational Titles Job Description - www.occupationalinfo.org.	2	0	0	11400000
result	171	statistician	organic	https://ukjobs.uky.edu/postings/169774	University of Kentucky Applicant Site | Statistician	Statistician. Below you will find the details for the position including any supplementary documentation and questions you should review before applying for the opening. To apply for the position, please click the Apply for this Job link/button. If you would like to bookmark this position for later review, click on the Bookmark ...	2	0	0	11400000
result	172	statistician	organic	https://genius.com/Todd-snider-statisticians-blues-lyrics	Todd Snider – Statistician's Blues Lyrics | Genius Lyrics	May 14, 2002 - Statistician's Blues Lyrics: They say that three percent of people / Use five to six percent of their brain / Ninety-seven percent use just three percent / And the rest goes down the drain / I'll never know.	2	0	0	11400000
result	173	statistician	organic	http://www.iaos-isi.org/index.php/statistics-prize	documents - IAOS	The IAOS is pleased to announce that the international Selection Committee has completed its review and rating of the papers submitted for the 2017 IAOS Prize for Young Statisticians. The Selection Committee was favorably impressed by the general quality of the papers submitted and judging them was a demanding ...	2	0	0	11400000
result	174	statistician	organic	https://todaysmilitary.com/working/careers/statisticians	Statisticians - Today's Military	Overview. In the Military, people need to know that the equipment they are using will perform as expected when a crisis arises. Industrial engineers manage quality-control programs to ensure that the Military develops and uses high-quality products and systems. They also do research to determine the most effective ways ...	2	0	0	11400000
result	175	statistician	organic	http://www.spiegel.de/international/europe/chief-greek-statistician-charged-for-revealing-true-size-of-debt-a-882942.html	Chief Greek Statistician Charged for Revealing True Size of Debt ...	Feb 12, 2013 - He was hired to bring Greece's debt statistics in line with European norms. Now, chief statistician Andreas Georgiou faces jail time for allegedly producing inflated budget deficit numbers. He says he was merely being honest, and he has plenty of support in Europe.	2	0	0	11400000
result	176	statistician	organic	https://ourtowndc.com/marty-aronoff-legend/	Marty Aronoff - "The Legend" - Sports Statistician - Our Town	Jan 9, 2017 - I'm sorry that they have to take this fifth game, I thought they were going to win. I just felt so good at getting Kirshel out of there was a made thing, but it didn't happen. Anyway Marty, Janice just pointed out to me, being a dummy, I assume everybody knows Marty Aronoff is the world's greatest statistician.	2	0	0	11400000
result	177	statistician	organic	https://stats.stackexchange.com/questions/1337/statistics-jokes	references - Statistics Jokes - Cross Validated	A statistician's wife had twins. He was delighted. He rang the minister who was also delighted. "Bring them to church on Sunday and we'll baptize them," said the minister. "No," replied the statistician. "Baptize one. We'll keep the other as a control." STATS: The Magazine For Students of Statistics, Winter 1996, Number 15.	2	0	0	11400000
result	178	statistician	organic	http://www.sciencemag.org/news/2014/12/star-statistician-hans-rosling-takes-ebola	Star statistician Hans Rosling takes on Ebola | Science | AAAS	Star statistician Hans Rosling takes on Ebola. By Kai Kupferschmidt Dec. 2, 2014 , 2:45 PM. MONROVIA—Hans Rosling is a global health celebrity, a former head of the Division of Global Health at the Karolinska Institute in Stockholm whose riveting lectures have made him a star of TED talks, and a fixture of the World ...	2	0	0	11400000
result	179	statistician	organic	http://fivethirtyeight.com/features/statisticians-found-one-thing-they-can-agree-on-its-time-to-stop-misusing-p-values/	Statisticians Found One Thing They Can Agree On: It's Time To Stop ...	Mar 7, 2016 - How many statisticians does it take to ensure at least a 50 percent chance of a disagreement about p-values? According to a tongue-in-cheek assessment by statistician George Cobb of Mount Holyoke College, the answer is two … or one. So it's no surprise that when the American Statistical Association ...	2	0	0	11400000
