TYPE	NUMBER	KEYWORD	ORGANIC	URL	TITLE	DESCRIPTION	PAGE	FLAG_HACKED	FLAG_HARMFUL	STAT_RESULTCOUNT
result	1	statistician	organic	https://money.usnews.com/careers/best-jobs/statistician	Statistician jobs, salary, job satisfaction - US News Money	Statisticians rank #1 in Best Business Jobs. ... To qualify for statistics-related jobs, statisticians should have at least a bachelor's degree in statistics. ... Here's how Statisticians job satisfaction is rated in terms of upward mobility, stress level and flexibility.	1	0	0	11400000
result	2	statistician	organic	https://en.wikipedia.org/wiki/Statistician	Statistician - Wikipedia	A statistician is a person who works with theoretical or applied statistics. The profession exists in both the private and public sectors. It is common to combine statistical knowledge with expertise in other subjects, and statisticians may work as employees or as statistical consultants.	1	0	0	11400000
result	3	statistician	organic	https://www.bls.gov/ooh/math/mathematicians-and-statisticians.htm	Mathematicians and Statisticians - Bureau of Labor Statistics	Mathematicians and statisticians analyze data and apply mathematical and statistical techniques to help solve real-world problems in business, engineering, healthcare, or other fields.	1	0	0	11400000
result	4	statistician	organic	https://www.indeed.com/q-Statistician-jobs.html	Statistician Jobs, Employment | Indeed.com	1721 Statistician jobs available on Indeed.com. Data Scientist, Statistician, Summer Intern and more!	1	0	0	11400000
result	5	statistician	organic	https://www.onetonline.org/link/summary/15-2041.00	15-2041.00 - Statisticians - O*Net	Sample of reported job titles: Assistant Division Chief for Statistical Program Management, Clinical Statistics Manager, Human Resource Statistician, Private Statistical/Psychometric Consultant, Program Research Specialist, Senior Statistician, Statistical Analyst, Statistician, Statistician (Demographer), Trend Investigator.	1	0	0	11400000
result	6	statistician	organic	https://www.princetonreview.com/careers/149/statistician	Statistician Careers | The Princeton Review	A good statistician is involved in survey development and data collection from the beginning, ensuring the validity and usefulness of the data. Statisticians are employed by private and public concerns and apply their skills to specific industry issues, such as economic analysis, inventory control problems, health problems, ...	1	0	0	11400000
result	7	statistician	organic	http://www.mastersindatascience.org/careers/statistician/	How to Become a Statistician | Statistician Salary	Statisticians apply statistical theories and methods to collect, analyze and interpret quantitative data. They work for companies involved in market research and public opinion, for industries concerned with areas such as quality control and product development, and – frequently – for local, state and federal governments.	1	0	0	11400000
result	8	statistician	organic	https://qz.com/1181278/statistician-is-one-of-the-fastest-growing-jobs-for-the-future/	Statistician will be one of the fastest-growing jobs over the next 10 ...	Jan 19, 2018 - Data geeks, rejoice! There has never been a better time to be a statistician. Consider the 10 jobs that the US Bureau of Labor Statistics (BLS) expects to grow fastest from 2016 to 2026, shown in the chart below. This is based on a recently released report and only includes jobs that more than 20000...	1	0	0	11400000
result	9	statistician	organic	https://study.com/become_a_statistician.html	Become a Statistician | Education and Career Roadmap - Study.com	Prospective students searching for become a statistician found the following information relevant and useful.	1	0	0	11400000
result	10	statistician	organic	https://bigfuture.collegeboard.org/careers/computers-math-statisticians	Become a Statistician - Careers - The College Board	Learn about what a statistician is and what statisticians do. Explore the academic path to this career to see if it's the right one for you.	1	0	0	11400000
result	11	statistician	organic	http://thisisstatistics.org/more-good-news-statistician-among-top-jobs-in-2018/	More Good News: Statistician Among Top Jobs in 2018 | This is Statistics	More Good News: Statistician Among Top Jobs in 2018. January 5, 2018. If your New Year's resolution happens to be finding a job in statistics, you're in luck. With fast technological advancements in areas like Artificial Intelligence and expected job market growth in the first quarter of 2018, employers are starting the year ...	1	0	0	11400000
result	12	statistician	organic	http://thisisstatistics.org/students/	Students | This is Statistics	Why Study Statistics? Statistician is the coolest job you've never heard of. Don't take our word for it; see for yourself all the great things you can do with a career in statistics. MakeDifferenceIcon Change the World. Statisticians contribute to society in many ways, from protecting endangered species and managing the impacts ...	1	0	0	11400000
result	13	statistician	organic	http://www.worldofstatistics.org/statistics-as-a-career/what-fields-employ-statisticians/	What Fields Employ Statisticians? - World of Statistics	One advantage of working in statistics is that you can combine your interest with almost any other field in science, technology, or business, such as: Agriculture Animal Population Astronomy Biology Census Chemistry Computer Science Demography Ecology Economics Education Engineering Epidemiology.	1	0	0	11400000
result	14	statistician	organic	https://www.mynextmove.org/profile/summary/15-2041.00	Statisticians at My Next Move	Develop or apply mathematical or statistical theory and methods to collect, organize, interpret, and summarize numerical data to provide usable information. May specialize in fields such as bio-statistics, agricultural statistics, business statistics, or economic statistics. Includes mathematical and survey statisticians. On the job ...	1	0	0	11400000
result	15	statistician	organic	https://study.com/articles/Statistician_Information_About_a_Career_in_the_Stats_Professions.html	Statistician: Information About a Career in the Stats Professions	Statisticians collect numerical data and draw conclusions from the information gathered. They develop surveys and conduct studies that help businesses and communities plan for the future. They may predict how well a new product or television show will perform or help community leaders plan future housing needs by ...	1	0	0	11400000
result	16	statistician	organic	https://www.prospects.ac.uk/job-profiles/statistician	Statistician job profile | Prospects.ac.uk	Working as statistician means dealing with data and helping to find practical solutions to problems. If you are keen on numbers, IT and like compiling information, this could be the role for you. Statisticians are concerned with the collection, analysis, interpretation and presentation of quantitative information. They work in a ...	1	0	0	11400000
result	17	statistician	organic	https://www.census.gov/about/census-careers/opportunities/location/headquarters/stat-an.html	Statistician / Analyst - Census Bureau	Feb 28, 2017 - Statisticians at the Census Bureau work with a variety of different data. Learn more about working as a statistician / analyst here.	1	0	0	11400000
result	18	statistician	organic	http://www.dictionary.com/browse/statistician	Statistician | Define Statistician at Dictionary.com	Statistician definition, an expert in or compiler of statistics. See more.	1	0	0	11400000
result	19	statistician	organic	https://www.careerbuilder.com/jobs-statistician	Statistician Jobs - Apply Now | CareerBuilder	Search CareerBuilder for Statistician Jobs and browse our platform. Apply now for jobs that are hiring near you.	1	0	0	11400000
result	20	statistician	organic	https://www.rand.org/statistics/jobs.html	Statistician Positions at RAND | RAND	Statisticians at RAND have many exciting opportunities to advance policy research by collaborating on multidisciplinary project teams, developing statistical methods, and leading research projects. There are also opportunities to teach at the Pardee RAND Graduate School. Our group of 14 Ph.D. statisticians and 11 ...	1	0	0	11400000
result	21	statistician	organic	https://www.environmentalscience.org/career/statistician	Statistician - Environmental Science	Regardless of where a statistician works, typical responsibilities may include data acquisition or assessing results from previous studies; they may even be responsible for designing how data is gathered. These professionals will be experts in applying the relevant statistical methodology to complex or big data sets. They will ...	1	0	0	11400000
result	22	statistician	organic	https://www.payscale.com/research/US/Job=Statistician/Salary	Statistician Salary - PayScale	As of Feb 2018, the average pay for a Statistician is $71433 annually or $30.04 /hr.	1	0	0	11400000
result	23	statistician	organic	https://www.sokanu.com/careers/statistician/	What does a Statistician do? - Sokanu	A statistician is someone who uses mathematical techniques to analyze and interpret data and draw conclusions. Although they work mostly in offices, they may travel in order to supervise surveys or gather data.	1	0	0	11400000
result	24	statistician	organic	http://statsaddin.com/	Statistician – Powerful, Easy to Use Statistics Add-In for Excel	Statistician works in a unique way when compared to other Excel based statistical analysis software. Most importantly, it allows the user to store a data set and perform multiple analyses on it, a method used by all high end statistical software, but lacking in many other Excel add-ins which require the user to reselect data ...	1	0	0	11400000
result	25	statistician	organic	https://en.wiktionary.org/wiki/statistician	statistician - Wiktionary	English[edit]. Pronunciation[edit]. IPA: /ˌstætɪsˈtɪʃn̩/. Noun[edit]. statistician (plural statisticians). A person who compiles, interprets, or studies statistics. (mathematics) A mathematician with a specialty of statistics. Translations[edit]. ±show ▽person who compiles, interprets, or studies statistics. Select targeted languages ...	1	0	0	11400000
result	26	statistician	organic	https://www.careergirls.org/resources/how-do-i-do-this/statistician	Becoming a Statistician - Career Girls	Statistician. What is this job like? Statisticians use statistical methods to collect and analyze data and to help solve real-world problems in business, engineering, healthcare, or other fields. Statisticians often use samples to collect information. A sample provides information about a small group within a much larger group.	1	0	0	11400000
result	27	statistician	organic	https://www.thefreedictionary.com/statistician	Statistician - definition of statistician by The Free Dictionary	Define statistician. statistician synonyms, statistician pronunciation, statistician translation, English dictionary definition of statistician. n. 1. A mathematician specializing in statistics. 2. A compiler of statistical data. n 1. a person who specializes in or is skilled at statistics 2.	1	0	0	11400000
result	28	statistician	organic	https://www.fda.gov/AboutFDA/WorkingatFDA/CareerDescriptions/ucm113298.htm	Career Descriptions > Statistician Positions at FDA	Apr 3, 2017 - View all current FDA job openings at USAJOBS. Description of Position. FDA mathematical statisticians, in a non-laboratory setting, perform duties that include: reviewing and evaluating scientific data and mathematical and statistical methods, and the procedures and concepts involved with New Drug ...	1	0	0	11400000
result	29	statistician	organic	http://onlinelibrary.wiley.com/journal/10.1111/(ISSN)1467-9884	Journal of the Royal Statistical Society: Series D (The Statistician ...	This journal ceased in 2004. For more recent papers please visit other Royal Statistical Society Journals: Journal of the Royal Statistical Society - Series A: Statistics in Society · Journal of the Royal Statistical Society - Series B: Statistical Methodology · Journal of the Royal Statistical Society - Series C: Applied Statistics ...	1	0	0	11400000
result	30	statistician	organic	https://www.linkedin.com/jobs/statistician-jobs	2,000+ Statistician Jobs | LinkedIn	Today's top 2354 Statistician jobs in United States. Leverage your professional network, and get hired. New Statistician jobs added daily.	1	0	0	11400000
result	31	statistician	organic	https://targetjobs.co.uk/careers-advice/job-descriptions/279107-statistician-job-description	Statistician: job description | TARGETjobs	What does a statistician do? Typical employers | Qualifications and training | Key skills A statistician gathers numerical data and then displays it, helping companies to make sense of quantitative data and to spot trends and make predictions. Typical responsibilities of the job include:	1	0	0	11400000
result	32	statistician	organic	https://www.truity.com/career-profile/statistician	Statistician Career Profile | Job Description, Salary, and Growth | Truity	Statisticians use computers with specialized statistical software to analyze data. In their analyses, statisticians identify trends and relationships within the data. They also conduct tests to find out the data's reliability and validity. Some statisticians may help create new statistical software packages to analyze data more ...	1	0	0	11400000
result	33	statistician	organic	http://www.mayo.edu/research/departments-divisions/department-health-sciences-research/division-biomedical-statistics-informatics/professional-opportunities/ms-statistician	M.S. Statistician - Division of Biomedical Statistics and Informatics ...	M.S. Statistician. The division occasionally has opportunities for master's level statisticians. To check for current openings, enter "statistician" as a keyword at Mayo Clinic's job website. At this site, you'll be able to apply for an open position by completing an online application. Additionally, Mayo Clinic in Arizona and Mayo ...	1	0	0	11400000
result	34	statistician	organic	https://boards.greenhouse.io/cruise/jobs/841044	Job Application for Statistician at Cruise - Greenhouse	We're the driverless car company. We're building the world's best autonomous vehicles to safely connect people to the places, things, and experiences they care about. Our vehicles are on the road in California, Arizona, and Michigan navigating some of the most challenging and unpredictable driving environments. We're ...	1	0	0	11400000
result	35	statistician	organic	https://www.simplyhired.com/search?q=statistician	20 Best Statistician jobs (Hiring Now!) | Simply Hired	1510 Statistician jobs available. See salaries, compare reviews, easily apply, and get hired. New Statistician careers are added daily on SimplyHired.com. The low-stress way to find your next Statistician job opportunity is on Simply Hired. There are over 1510 Statistician careers waiting for you to apply!	1	0	0	11400000
result	36	statistician	organic	https://github.com/jtleek/datasharing	GitHub - jtleek/datasharing: The Leek group guide to data sharing	README.md. How to share data with a statistician. This is a guide for anyone who needs to share data with a statistician or data scientist. The target audiences I have in mind are: Collaborators who need statisticians or data scientists to analyze data for them; Students or postdocs in various disciplines looking for consulting ...	1	0	0	11400000
result	37	statistician	organic	https://www.allaboutcareers.com/careers/job-profile/statistician	Statistician Job Description | AllAboutCareers	Job Description. A statistician is responsible for the collation, evaluation, interpretation and presentation of quantitative data. Statisticians provide insights, recommendations, and advice on policy and strategy to internal or external clients. The scope of a statistician's responsibilities include the monitoring of data collection ...	1	0	0	11400000
result	38	statistician	organic	https://www.glassdoor.com/Job/chicago-statistician-jobs-SRCH_IL.0,7_IC1128808_KO8,20.htm	1,104 jobs hiring now for Statistician in Chicago, IL | Glassdoor	Search Statistician jobs in Chicago, IL with company ratings & salaries. 1104 open jobs for Statistician in Chicago.	1	0	0	11400000
result	39	statistician	organic	http://www.thesaurus.com/browse/statistician	Statistician Synonyms, Statistician Antonyms | Thesaurus.com	Synonyms for statistician at Thesaurus.com with free online thesaurus, antonyms, and definitions. Dictionary and Word of the Day.	1	0	0	11400000
result	40	statistician	organic	https://dictionary.cambridge.org/us/pronunciation/english/statistician	How to pronounce statistician in English - Cambridge Dictionary	How to pronounce statistician. How to say statistician. Listen to the audio pronunciation in the Cambridge English Dictionary. Learn more.	1	0	0	11400000
result	41	statistician	organic	https://www.monster.com/jobs/q-statistician-jobs.aspx	Statistician Jobs - Search Statistician Job Listings | Monster	Search for Statistician jobs at Monster. Browse our collection of Statistician job listings, including openings in full time and part time.	1	0	0	11400000
result	42	statistician	organic	https://www.amazon.com/Accidental-Statistician-Life-Memories-George/dp/1118400887	Amazon.com: An Accidental Statistician: The Life and Memories of ...	Celebrating the life of an admired pioneer in statistics. In this captivating and inspiring memoir, world-renowned statistician George E. P. Box offers a firsthand account of his life and statistical work. Writing in an engaging, charming style, Dr. Box reveals the unlikely events that led him to a career in statistics, beginning with ...	1	0	0	11400000
result	43	statistician	organic	https://unjobs.org/themes/statistician	Vacancies for 'Statistician' | UNjobs	Regional Expert on Social Statistics, Santiago ECLAC - Economic Commission for Latin America and the Caribbean Updated: about 13 hours ago. Closing date: Tuesday, 17 April 2018. Statistician, Egypt, Cairo FAO - Food and Agriculture Organization of the United Nations Updated: a day ago. Closing date: Saturday, 24 ...	1	0	0	11400000
result	44	statistician	organic	https://www.shmoop.com/careers/statistician/	Statistician: The Real Poop - Shmoop	Want to be a Statistician? Learn the low-down by reading Shmoop's career overview that outlines what it takes to get and keep the job.	1	0	0	11400000
result	45	statistician	organic	https://www.tandfonline.com/toc/utas20/current	The American Statistician: Vol 71, No 4 - Taylor & Francis Online	ASA member? Log in to the Members Only area on the ASA website to access ASA journal content. Call for papers. Welcoming Submissions for The American Statistician Special Issue: Statistical Inference in the 21st Century: A World Beyond P<0.05 ...	1	0	0	11400000
result	46	statistician	organic	https://twitter.com/hashtag/statistician?lang=en	#statistician hashtag on Twitter	See Tweets about #statistician on Twitter. See what people are saying and join the conversation.	1	0	0	11400000
result	47	statistician	organic	https://www.collinsdictionary.com/us/dictionary/english/statistician	Statistician definition and meaning | Collins English Dictionary	Statistician definition: A statistician is a person who studies statistics or who works using statistics. | Meaning, pronunciation, translations and examples.	1	0	0	11400000
result	48	statistician	organic	https://www.amstat.org/ASA/Your-Career/home.aspx	Your Career - American Statistical Association	Your Career. Welcome to the ASA's career center, where you will find information about the ASA's accreditation, awards and recognition, and professional development programs. You also will have access to resources such as fellowships and grants, external funding sources, ethical guidelines for statisticians, and salary ...	1	0	0	11400000
result	49	statistician	organic	https://www.merriam-webster.com/dictionary/statistician	Statistician | Definition of Statistician by Merriam-Webster	Define statistician: one versed in or engaged in compiling statistics.	1	0	0	11400000
result	50	statistician	organic	http://wmbriggs.com/	William M. Briggs – Statistician to the Stars!	Contact Me. Résumé I am a wholly independent vagabond writer, statistician, scientist and consultant. Previously a Professor at the Cornell Medical School, … Continue Reading Contact Me. March 8, 2018 | No comments ...	1	0	0	11400000
result	51	statistician	organic	https://www.ldoceonline.com/dictionary/statistician	statistician | meaning of statistician in Longman Dictionary of ...	statistician• Accountants, personnel administrators, economists, data processing experts and statisticians are all experts in a specialised field of work.• As any statistician will confirm, it is unwise to infer trends from change over a single year.• Philip Redfern suggested it should become standard practice for statisticians to put ...	1	0	0	11400000
result	52	statistician	organic	https://www.ziprecruiter.com/Jobs/Statistician/-in-Dallas,TX	$65k-$114k Statistician Jobs in Dallas, TX | ZipRecruiter	Browse 2063+ DALLAS, TX STATISTICIAN job ($65K-$114K) listings hiring now from companies with openings. Find your next job opportunity near you & 1-Click Apply!	1	0	0	11400000
result	53	statistician	organic	https://www.science.purdue.edu/careers/what_can_i_do_with_a_major/sports_statistician.html	Purdue College of Science: Sports Statistician	Sports Statistician. Sports statisticians analyze data pertaining to sporting events, usually for major sports such as baseball, football or basketball. Sometimes called a scorer, sports statisticians record data live as it occurs.	1	0	0	11400000
result	54	statistician	organic	https://careers.walmart.com/us/jobs/894707BR-statistician-san-bruno-ca	Statistician in SAN BRUNO, CA | Walmart Careers	Apply online for the Statistician position in SAN BRUNO, CA at Walmart and Sam's Club!	1	0	0	11400000
result	55	statistician	organic	http://money.cnn.com/gallery/pf/2017/01/05/best-jobs-2017/87.html	Statistician - 2017 Best Jobs in America - CNNMoney	Jan 5, 2017 - Notes: All pay data from PayScale.com. Median pay is for an experienced worker (at least five or seven years in the field). Top pay represents the 90th percentile. Job growth is estimated for 2014-24, and based on people working in broader 'job family' from the Bureau of Labor Statistics. For more details ...	1	0	0	11400000
result	56	statistician	organic	https://abbvie.referrals.selectminds.com/jobs/senior-research-statistician-66	Senior Research Statistician - AbbVie Careers	Statistics is responsible for providing services in the area of biostatistics and mathematics to all corporate divisions. These services are supplied....	1	0	0	11400000
result	57	statistician	organic	https://www.nytimes.com/2017/05/19/upshot/the-little-known-statistician-who-transformed-education.html	The Little-Known Statistician Who Taught Us to Measure Teachers ...	May 19, 2017 - Thirty-five years ago, a statistician, William S. Sanders, offered an answer to that puzzle. It relied, unexpectedly, on statistical methods that were developed to understand animal breeding patterns. Mr. Sanders died in March in his home state, Tennessee, at age 74, with his name little known outside ...	1	0	0	11400000
result	58	statistician	organic	https://www.uclahealthcareers.org/job/7984709/statistician-westwood-ca/	Statistician | UCLA Health | Job #H94716 | Westwood, CA	Jan 22, 2018 - ResponsibilitiesIndividual to provide data base construction, data management, statistical analysis and advanced statistical modeling for Dr. Joann Elmore in the Department of Medicine in the Division of General Internal Medicine & Health Services Research. Primary job duties include collaborating on ...	1	0	0	11400000
result	59	statistician	organic	https://gradireland.com/careers-advice/job-descriptions/statistician-0	Statistician | gradireland	Alternative job titles for this role Actuary Research statistician Biostatistician Clinical statistician Econometrician Data analyst Introduction.	1	0	0	11400000
result	60	statistician	organic	https://www.wsj.com/articles/greeces-response-to-its-resurgent-debt-crisis-prosecute-the-statistician-1486396434	Greece's Response to Its Resurgent Debt Crisis: Prosecute the ...	Feb 6, 2017 - Some people in high places know just whom to blame—a statistician in rural Maryland. Before Greece's debt crisis, its governments manipulated statistics and masked the size of budget deficits, waste and patronage. The statistician, Andreas Georgiou, moved from the U.S. to become Greece's first ...	1	0	0	11400000
result	61	statistician	organic	https://www.campusexplorer.com/careers/46903395/statisticians/	Career Information: Statisticians - Campus Explorer	Detailed career information for Statisticians including salary, job outlook, employment opportunities and career training programs.	1	0	0	11400000
result	62	statistician	organic	https://www.automaticstatistician.com/examples/	Examples - Automatic Statistician	Airline passenger volume. A classic data set demonstrating non-stationary periodicity Solar irradiance. The automatic statistician identifies the unusual period of very low sun spot activity known as the Maunder minimum Sulphuric acid production. Creative usage of change points. Unemployment figures. An example where ...	1	0	0	11400000
result	63	statistician	organic	https://www.automaticstatistician.com/	Automatic Statistician	... to public data, and commercial data, there are relatively few people trained in the statistical and machine learning methods required to test hypotheses, make predictions, and otherwise create interpretable knowledge from this data. The Automatic Statistician project aims to build an artificial intelligence for data science, ...	1	0	0	11400000
